id,title,url,author,points,num_comments,created_at,created_at_i,story_text,tags,hn_url
3408196,"Tech’s Relationship With Depression, Suicide and Asperger’s",http://www.zdnet.com/blog/violetblue/techs-relationship-with-depression-suicide-and-aspergers/904,dotBen,2,0,2011-12-30 16:56:58+00:00,1325264218,,"story, author_dotBen, story_3408196",https://news.ycombinator.com/item?id=3408196
3408203,How to change your organization to embrace mobile w/ Johann Huber-Gutierrez,http://untether.tv/2011/how-your-organization-needs-to-change-in-order-to-truly-embrace-mobile-with-johann-huber-gutierrez//,robwoodbridge,1,0,2011-12-30 16:58:21+00:00,1325264301,,"story, author_robwoodbridge, story_3408203",https://news.ycombinator.com/item?id=3408203
3408204,The DCI Architecture: A New Vision of Object-Oriented Programming,http://www.artima.com/articles/dci_vision.html,divisionbyzero,2,0,2011-12-30 16:58:22+00:00,1325264302,,"story, author_divisionbyzero, story_3408204",https://news.ycombinator.com/item?id=3408204
3408206,Most Disqussed 2011,http://blog.disqus.com/post/15031236432/most-disqussed-2011,ro_gupta,2,0,2011-12-30 16:58:33+00:00,1325264313,Most commented topics across the Disqus network in 2011,"story, author_ro_gupta, story_3408206",https://news.ycombinator.com/item?id=3408206
3408209,The Death of MIX and the Future of Microsoft on the Web,http://www.piehead.com/blog/2011/12/the-death-of-mix-and-the-future-of-microsoft-on-the-web,scoregoals12,2,0,2011-12-30 16:58:53+00:00,1325264333,,"story, author_scoregoals12, story_3408209",https://news.ycombinator.com/item?id=3408209
3408214,Understanding the Ecosystem of Modern Malware,http://www.securityweek.com/understanding-ecosystem-modern-malware,privacyguru,1,0,2011-12-30 16:59:26+00:00,1325264366,,"story, author_privacyguru, story_3408214",https://news.ycombinator.com/item?id=3408214
3408220,28C3 Chaos Communication Congress Recordings,http://events.ccc.de/congress/2011/wiki/Documentation,ugh,4,0,2011-12-30 17:02:09+00:00,1325264529,,"story, author_ugh, story_3408220",https://news.ycombinator.com/item?id=3408220
3408233,Ask HN: What open source monitoring tool do you use in AWS?,,brettweaverio,3,0,2011-12-30 17:06:29+00:00,1325264789,"I'm looking to implement a monitoring solution for an AWS hosted application.  I don't want to re-invent the wheel, and would like to focus my efforts on tools that are built to:<p>* Reconfigure easily based on elastic applications<p>* Flexible plugins and monitoring profiles which can easily be extended<p>Anyone have success / horror stories to share?","story, author_brettweaverio, story_3408233, ask_hn",https://news.ycombinator.com/item?id=3408233
3408242,The surveillance state of social networking,http://bogon-flux.blogspot.com/,Exoseq,1,0,2011-12-30 17:07:58+00:00,1325264878,,"story, author_Exoseq, story_3408242",https://news.ycombinator.com/item?id=3408242
3408246,Foursquare and the coming end of the check-in economy,http://untether.tv/2011/foursquare-and-the-coming-end-of-the-check-in-economy//,robwoodbridge,2,0,2011-12-30 17:09:17+00:00,1325264957,,"story, author_robwoodbridge, story_3408246",https://news.ycombinator.com/item?id=3408246
3408252,Google Wallet stores too much unencrypted data in a rooted device--report,http://news.cnet.com/8301-27080_3-57341844-245/google-wallet-stores-too-much-unencrypted-data-in-a-rooted-device-report/,boh,1,0,2011-12-30 17:11:40+00:00,1325265100,,"story, author_boh, story_3408252",https://news.ycombinator.com/item?id=3408252
3408266,Use #code2011 to tweet which programming languages you used this year,,deadprogram,10,0,2011-12-30 17:16:28+00:00,1325265388,,"story, author_deadprogram, story_3408266, ask_hn",https://news.ycombinator.com/item?id=3408266
3408274,How Tetris became the world's favorite computer game,http://www.bbc.co.uk/news/world-us-canada-16350234,dpapathanasiou,4,0,2011-12-30 17:20:45+00:00,1325265645,,"story, author_dpapathanasiou, story_3408274",https://news.ycombinator.com/item?id=3408274
3408286,5 Open Source Startups to Watch in 2012,http://siliconangle.com/blog/tag/open-source-startups-to-watch/,klintron,3,0,2011-12-30 17:25:00+00:00,1325265900,,"story, author_klintron, story_3408286",https://news.ycombinator.com/item?id=3408286
3408291,Internet Protocol Design and Implementation,http://root.org/ip-development/index.html,powertower,1,0,2011-12-30 17:27:10+00:00,1325266030,,"story, author_powertower, story_3408291",https://news.ycombinator.com/item?id=3408291
3408307,How To Properly Tie Cables,http://www.thegeekscompanion.com/home/how-to-properly-tie-cables.html,devirkahan,2,0,2011-12-30 17:31:50+00:00,1325266310,,"story, author_devirkahan, story_3408307",https://news.ycombinator.com/item?id=3408307
3408316,"Docomo, Fujitsu, Renesas: The triangle thickens",http://www.eetimes.com/electronics-blogs/rambling--round/4233698/Docomo--Fujitsu--Renesas--The-triangle-thickens,junkoyoshida,3,1,2011-12-30 17:33:40+00:00,1325266420,,"story, author_junkoyoshida, story_3408316",https://news.ycombinator.com/item?id=3408316
3408323,"GoDaddy wins, and loses, Move Your Domain Day over SOPA",http://arstechnica.com/tech-policy/news/2011/12/move-your-domain-day-only-a-blip-but-godaddy-officially-opposes-sopa.ars,sbashyal,3,0,2011-12-30 17:35:41+00:00,1325266541,,"story, author_sbashyal, story_3408323",https://news.ycombinator.com/item?id=3408323
3408327,I made progress bars using only CSS3. You can use them for free.,http://dipperstove.com/design/css3-progress-bars.html,jsullivandigs,225,32,2011-12-30 17:36:45+00:00,1325266605,,"story, author_jsullivandigs, story_3408327",https://news.ycombinator.com/item?id=3408327
3408337,"My New Year’s resolution: 5,760 by 1,080 ",http://www.extremetech.com/gaming/111199-my-new-years-resolution-5760-by-1080,evo_9,5,0,2011-12-30 17:40:33+00:00,1325266833,,"story, author_evo_9, story_3408337",https://news.ycombinator.com/item?id=3408337
3408340,Herb Sutter : Welcome to the Jungle,http://herbsutter.com/welcome-to-the-jungle/,keveman,8,0,2011-12-30 17:41:41+00:00,1325266901,,"story, author_keveman, story_3408340",https://news.ycombinator.com/item?id=3408340
3408343,Using Bootstrap alerts with Backbone,http://grahamrhay.wordpress.com/2011/12/30/using-bootstrap-alerts-with-backbone/,grahamrhay,3,0,2011-12-30 17:42:35+00:00,1325266955,,"story, author_grahamrhay, story_3408343",https://news.ycombinator.com/item?id=3408343
3408344,Ask HN: VPS Solution for a limited-budget emerging startup,,alpb,3,10,2011-12-30 17:42:36+00:00,1325266956,"Currently we are using Linode VPS with 512 MB RAM however that was quite insufficient for us. We are looking for a VPS solution that does not exceed $25/mo (that's true, since we're just students in a developing country) and offer &#62;=1 GB RAM and at least dual core processor. We looked at Hetzner.de VPs solutions, which are recommended by many people however they offer single core processor virtualizations.<p>Can HN recommend us a good option that we can use for prototyping in short term?","story, author_alpb, story_3408344, ask_hn",https://news.ycombinator.com/item?id=3408344
3408380,All is here in,http://www.wingsmag.com,mdmomenin,1,0,2011-12-30 17:53:24+00:00,1325267604,,"story, author_mdmomenin, story_3408380",https://news.ycombinator.com/item?id=3408380
3408388,Unlock + fetch authcodes to leave GoDaddy,http://www.laterdaddy.com/,cat,1,0,2011-12-30 17:54:31+00:00,1325267671,,"story, author_cat, story_3408388",https://news.ycombinator.com/item?id=3408388
3408392,"I Don't Like The Term ""Cloud Hosting""",http://www.weaver.io/post/15033963173/i-dont-like-the-term-cloud-hosting,brettweaverio,5,0,2011-12-30 17:55:46+00:00,1325267746,,"story, author_brettweaverio, story_3408392",https://news.ycombinator.com/item?id=3408392
3408406,The Effect of University Monopoly Licensing in 3D Printing,http://rtei.org/blog/2011/12/29/the-effect-of-university-monopoly-licensing-in-3d-printing/,afiler,2,0,2011-12-30 18:00:19+00:00,1325268019,,"story, author_afiler, story_3408406",https://news.ycombinator.com/item?id=3408406
3408407,"Spamhaus Nightmare: Domain Shut Down, No Notice, Over A Million Pages Down",,jpadvo,245,95,2011-12-30 18:00:34+00:00,1325268034,"I am writing this here on HN, because at the moment you cannot access our blog. Our domain name was shut down this morning, and I'm trying to get it back. Here's what happened...<p>Our company provides tools to help people put together pages for their businesses. Our free tool has been used to create over million page tabs on Facebook. Unfortunately but predictably, sometimes bad people use our app. Like spammers.<p>Overnight, our domain was blacklisted by Spamhaus because <i>one</i> of our pages contained spam. (Anybody want a free iPad?)<p>We run our infrastructure on Heroku, and use Bluehost for domain names. Well, as soon as Bluehost recieved notice from Spamhaus, they shut off the DNS for our domain. All million plus pages, gone in the blink of a DNS propagation.<p>Thankfully we were able to switch over to [appname].heroku.com for now and most of the pages are back, but we have paying customers who are in the dark because they rely on our custom domain name.<p>Our product, that over a million people rely on, suddenly ceased to exist. No advance notice. Nothing we could have done to stop it. Because of ONE bad apple.<p>This kind of thing will happen in SOPA world, if we let ourselves get there. But instead of being able to call my registrar and yell at them, I would have had to call the government, and oh-by-the-way they might fine or imprison me for having hosted spam.<p>Let me end with a practical, really-important-to-me-right-now question: is there any possible way to <i>not</i> get randomly nuked by Spamhaus?","story, author_jpadvo, story_3408407, ask_hn",https://news.ycombinator.com/item?id=3408407
3408408,2012 predictions? Not here,http://thewhatnoise.blogspot.com/2011/12/2012-predictions-not-here.html,Benjy,1,0,2011-12-30 18:00:40+00:00,1325268040,,"story, author_Benjy, story_3408408",https://news.ycombinator.com/item?id=3408408
3408409,Automate your Dropbox,http://www.dropboxautomator.com/,tilt,1,0,2011-12-30 18:01:13+00:00,1325268073,,"story, author_tilt, story_3408409",https://news.ycombinator.com/item?id=3408409
3408423," Ocean Marketing holds N-Control’s accounts hostage, relents after more drama",http://venturebeat.com/2011/12/30/ocean-marketing-n-control-hostage/,bond,2,0,2011-12-30 18:05:34+00:00,1325268334,,"story, author_bond, story_3408423",https://news.ycombinator.com/item?id=3408423
3408429,Learning about customer relationships by grouping iPhone apps,http://jaredbrown.me/post/15034447557/learning-about-customer-relationships-by-grouping,jaredbrown,1,0,2011-12-30 18:07:05+00:00,1325268425,,"story, author_jaredbrown, story_3408429",https://news.ycombinator.com/item?id=3408429
3408432,Cognitive Screening Test Killed Over Infringement Law,http://www.techdirt.com/articles/20111230/04095117235/doctors-discover-copyright-law-cognitive-screening-test-killed-over-infringement-claims.shtml?utm_source=dlvr.it&utm_medium=twitter,llambda,1,0,2011-12-30 18:07:24+00:00,1325268444,,"story, author_llambda, story_3408432",https://news.ycombinator.com/item?id=3408432
3408433,"Cheap, 'safe' drug kills most cancers",http://www.newscientist.com/article/dn10971-cheap-safe-drug-kills-most-cancers.html,nvk,3,2,2011-12-30 18:07:31+00:00,1325268451,,"story, author_nvk, story_3408433",https://news.ycombinator.com/item?id=3408433
3408436,Ask HN: Your Startup Progress (December 2011),,james-fend,7,7,2011-12-30 18:08:43+00:00,1325268523,"Just like last month:<p>What progress have you made on your startup for the month of December?? (full-time or on the side)
Launch something? Almost launching? Got featured on a great blog?<p>Guess I'll start off: Parted ways after getting ripped off by a terrible Ruby on Rails programmer and decided to learn myself Rails and have hacked away at Freelanceful.com. Hopefully will launch in a couple weeks.","story, author_james-fend, story_3408436, ask_hn",https://news.ycombinator.com/item?id=3408436
3408440,Great example of crisis management in action (AvengerController),http://www.reddit.com/r/IAmA/comments/nw1vm/ama_the_guy_who_replaced_paul_christoforo_and_is/,DevX101,6,0,2011-12-30 18:09:15+00:00,1325268555,,"story, author_DevX101, story_3408440",https://news.ycombinator.com/item?id=3408440
3408442,Backyard Brains funding Open Access publication via Kickstarter,http://www.kickstarter.com/projects/2067585958/backyard-brains-operation-publication,joeyo,1,0,2011-12-30 18:09:26+00:00,1325268566,,"story, author_joeyo, story_3408442",https://news.ycombinator.com/item?id=3408442
3408445,Your New Year's Resolution--Pick Better Passwords,http://www.messagingnews.com/onmessage/ben-gross/your-new-years-resolution-pick-better-passwords,bengross,1,0,2011-12-30 18:09:52+00:00,1325268592,,"story, author_bengross, story_3408445",https://news.ycombinator.com/item?id=3408445
3408446,Time Tested Ways of Picking Color Combinations,http://blog.crazyegg.com/2011/12/30/pick-website-color-combination/,camlinke,2,0,2011-12-30 18:10:29+00:00,1325268629,,"story, author_camlinke, story_3408446",https://news.ycombinator.com/item?id=3408446
3408450,Format Strings in TextMate 2,http://blog.macromates.com/2011/format-strings/,jemeshsu,1,0,2011-12-30 18:10:47+00:00,1325268647,,"story, author_jemeshsu, story_3408450",https://news.ycombinator.com/item?id=3408450
3408453,Useful Development Tools for OS X in 2011,http://bradjasper.com/blog/useful-development-tools-for-os-x-2011.html,Jasber,1,0,2011-12-30 18:11:11+00:00,1325268671,,"story, author_Jasber, story_3408453",https://news.ycombinator.com/item?id=3408453
3408455,How SOPA Could Ruin My Life,http://www.forbes.com/sites/insertcoin/2011/12/16/how-sopa-could-ruin-my-life/,AdamFernandez,115,16,2011-12-30 18:11:23+00:00,1325268683,,"story, author_AdamFernandez, story_3408455",https://news.ycombinator.com/item?id=3408455
3408459,Amazon Has Drastically Changed the Way I Read,http://dbasch.posterous.com/amazon-has-drastically-changed-the-way-i-read,diego,63,77,2011-12-30 18:12:09+00:00,1325268729,,"story, author_diego, story_3408459",https://news.ycombinator.com/item?id=3408459
3408463,Hedge funds underperform in the long term,http://blogs.wsj.com/marketbeat/2011/12/28/tough-markets-punishing-hedge-funds-since-2003/,spenrose,5,0,2011-12-30 18:12:46+00:00,1325268766,,"story, author_spenrose, story_3408463",https://news.ycombinator.com/item?id=3408463
3408467,Ask HN: Do you use Feedback Tabs?,,kurtvarner,2,1,2011-12-30 18:15:12+00:00,1325268912,"I'm in the process of developing my MVP, and I'm on the fence about implementing a feedback tab. You know, the ones that appear of the side of your browser. What are your thoughts on these? Do they actually increase feedback from users?<p>I feel like I used to see the tabs everywhere, but not so much anymore. Maybe they were simply a fad that didn't prove valuable.","story, author_kurtvarner, story_3408467, ask_hn",https://news.ycombinator.com/item?id=3408467
3408471,"Computer controlled plan economy, in the 70s",http://en.wikipedia.org/wiki/Cybersyn,Flow,2,0,2011-12-30 18:15:33+00:00,1325268933,,"story, author_Flow, story_3408471",https://news.ycombinator.com/item?id=3408471
3408480,In Afghanistan Your Phone Plays Taliban Ringtones or You Die,http://www.wired.com/dangerroom/2011/12/taliban-ringtone/?utm_source=feedburner&utm_medium=feed&utm_campaign=Feed%3A+WiredDangerRoom+%28Blog+-+Danger+Room%29,kposehn,1,0,2011-12-30 18:17:58+00:00,1325269078,,"story, author_kposehn, story_3408480",https://news.ycombinator.com/item?id=3408480
3408484,Let's start paying college athletes,http://www.nytimes.com/2012/01/01/magazine/lets-start-paying-college-athletes.html?pagewanted=1&ref=magazine,dfriedmn,1,0,2011-12-30 18:19:21+00:00,1325269161,,"story, author_dfriedmn, story_3408484",https://news.ycombinator.com/item?id=3408484
3408503,Apple’s Museum That Never Was: Why Does Stanford Keep it Secret?,http://mashable.com/2011/12/29/apple-stanford-archive/,tilt,1,0,2011-12-30 18:24:21+00:00,1325269461,,"story, author_tilt, story_3408503",https://news.ycombinator.com/item?id=3408503
3408506,Interview with Ann Arbor startup community leader Dug Song,http://www.semichiganstartup.com/founders/dugsongduosecurity.aspx,rmason,1,0,2011-12-30 18:24:58+00:00,1325269498,,"story, author_rmason, story_3408506",https://news.ycombinator.com/item?id=3408506
3408507,Stanford archives offer window into Apple origins,http://hosted2.ap.org/apdefault/3d281c11a96b4ad082fe88aa0db04305/Article_2011-12-29-US-Apple-Archives/id-73a280b640584ddd99aa14b37bdf4981,tilt,2,0,2011-12-30 18:25:13+00:00,1325269513,,"story, author_tilt, story_3408507",https://news.ycombinator.com/item?id=3408507
3408511,Chinese vendors form alliance to battle Apple and other patent predators,http://www.bgr.com/2011/12/30/chinese-vendors-form-alliance-to-battle-apple-and-other-patent-predators/,nr0mx,1,0,2011-12-30 18:25:47+00:00,1325269547,,"story, author_nr0mx, story_3408511",https://news.ycombinator.com/item?id=3408511
3408515,Your Team's Plus One,http://creativeleadership.com/your-teams-plus-one,erickhill,1,0,2011-12-30 18:26:00+00:00,1325269560,,"story, author_erickhill, story_3408515",https://news.ycombinator.com/item?id=3408515
3408518,Flame: My 2d Game Experiment,http://jlongster.com/2011/12/30/flame-my-2d-game-experiment.html,jlongster,1,0,2011-12-30 18:27:08+00:00,1325269628,,"story, author_jlongster, story_3408518",https://news.ycombinator.com/item?id=3408518
3408520,"GoDaddy profited from ""Move your Domain Day""",http://nwlinux.com/godaddy-profited-move-domain-day/,nwlinux,2,0,2011-12-30 18:28:17+00:00,1325269697,,"story, author_nwlinux, story_3408520",https://news.ycombinator.com/item?id=3408520
3408529,"Rare earth crisis: Innovate, or be crushed by China",http://www.extremetech.com/extreme/111029-rare-earth-crisis-innovate-or-be-crushed-by-china,llambda,64,22,2011-12-30 18:30:49+00:00,1325269849,,"story, author_llambda, story_3408529",https://news.ycombinator.com/item?id=3408529
3408536,The Rise of the New Global Elite,http://www.theatlantic.com/magazine/archive/2011/01/the-rise-of-the-new-global-elite/8343/?single_page=true,llambda,1,0,2011-12-30 18:32:22+00:00,1325269942,,"story, author_llambda, story_3408536",https://news.ycombinator.com/item?id=3408536
3408538,Go Slow to Go Fast,http://onticoren.com/go-slow-to-go-fast,craigkerstiens,72,17,2011-12-30 18:32:56+00:00,1325269976,,"story, author_craigkerstiens, story_3408538",https://news.ycombinator.com/item?id=3408538
3408544,Raytheon Books $50 Million in Electronic Warfare Contracts,http://raytheon.mediaroom.com/index.php?s=43&item=2005,jjp9999,1,0,2011-12-30 18:34:57+00:00,1325270097,,"story, author_jjp9999, story_3408544",https://news.ycombinator.com/item?id=3408544
3408546,"Building web app to help expose government corruption, who should I talk to",,devs1010,3,5,2011-12-30 18:35:13+00:00,1325270113,"I won't get into a long rant here but I have had enough experiences with law enforcement, the ""justice"" system and other aspects of government to where I am fed up and not going to take it anymore. I'm a web app developer, I've built web apps from start to finish before so I'm going to build something that I feel can help expose the things going on behind the scenes. I personally feel that there is enough info out there on the web that, if intelligentally aggregated and presented, can strike a chord with people, nothing extremist, no propaganda, just links to (or copies if legally permissable) of documents and short explanations of what they mean and why its f'ed up, so to speak, as well as perhaps links to and names of relevant people whom they should consider contacting to voice their displeasure. It would probably be best too to start with a few issues and focus around those at first rather than just a broad application about every issue under the sun.<p>I already have a lot of experience writing web crawlers, etc to scrape info so this part shouldn't be too hard for me, I am hoping, however to get in touch with others who share an interest and who may know more about the issues to help lead me to places that I can find document sets worth sorting through. Anyone know of any organizations, etc that I should consider getting in touch with?","story, author_devs1010, story_3408546, ask_hn",https://news.ycombinator.com/item?id=3408546
3408556,"Insync (“Dropbox For Google Users”) Gets Major Revamp, Goes Free",http://techcrunch.com/2011/12/30/insync-dropbox-revamp-free/,username3,1,0,2011-12-30 18:37:05+00:00,1325270225,,"story, author_username3, story_3408556",https://news.ycombinator.com/item?id=3408556
3408564,Show HN: Digital Effects Touch Pad (DEfT Pad),,saroshali,2,0,2011-12-30 18:38:25+00:00,1325270305,"Hey guys, I'm a long time reader and finally decided to start posting on HN.<p>I wanted to show off a proof of concept I've been working on (with 4 other friends), the Digital Effects Touch Pad: A touch screen device that gives guitarists the functionality of a distortion pedal with a user interface you don't even have to look at.<p>Landing Page: signup.deftpad.com<p>YouTube Demo: http://youtu.be/uviqezxvPdg<p>Survey (in case you're interested in the device): http://www.surveymonkey.com/s/2K6RQBZ<p>I'd love to get some feedback!","story, author_saroshali, story_3408564, show_hn",https://news.ycombinator.com/item?id=3408564
3408570,Teen Prodigy Recognized by Microsoft Now in Critical Condition,http://mashable.com/2011/12/30/teen-prodigy-recognized-by-microsoft-now-in-critical-condition/,ssclafani,2,1,2011-12-30 18:39:47+00:00,1325270387,,"story, author_ssclafani, story_3408570",https://news.ycombinator.com/item?id=3408570
3408585,Twine hits 450'000$ in pledges,http://www.kickstarter.com/projects/supermechanical/twine-listen-to-your-world-talk-to-the-internet?,tilt,1,0,2011-12-30 18:42:20+00:00,1325270540,,"story, author_tilt, story_3408585",https://news.ycombinator.com/item?id=3408585
3408593,"Google Recruiter Mike Junge on Startups, the Biggest Mistake Job Applicants Make",http://www.pehub.com/130171/google-recruiter-mike-junge-on-startups-the-biggest-mistake-job-applicants-make-and-why-it-pays-to-be-nice/,coolrhymes,3,1,2011-12-30 18:43:51+00:00,1325270631,,"story, author_coolrhymes, story_3408593",https://news.ycombinator.com/item?id=3408593
3408599,Fun vs Happiness,http://bennesvig.com/2011/12/30/fun-vs-happiness/,bennesvig,2,0,2011-12-30 18:44:21+00:00,1325270661,,"story, author_bennesvig, story_3408599",https://news.ycombinator.com/item?id=3408599
3408628,Meet Techolab (LatAm social innovation network and incubator) winners,http://andesbeat.com/2011/12/30/techolab-announces-winners-in-its-debut-competition-part-2-of-2/,clb22,1,0,2011-12-30 18:50:41+00:00,1325271041,,"story, author_clb22, story_3408628",https://news.ycombinator.com/item?id=3408628
3408641,"Does Python need something like Java's WAR files, to ease deployments?",http://kencochrane.net/blog/2011/12/standardizing-python-wsgi-deployment/,KenCochrane,6,2,2011-12-30 18:54:10+00:00,1325271250,,"story, author_KenCochrane, story_3408641",https://news.ycombinator.com/item?id=3408641
3408643,Hyperturtle Monad,http://dorophone.blogspot.com/2011/05/hyperturtle-monad-makes-pretty-pictures.html,gnosis,2,0,2011-12-30 18:54:47+00:00,1325271287,,"story, author_gnosis, story_3408643",https://news.ycombinator.com/item?id=3408643
3408648,Cloudmanic Labs : Thanks for a great 2011,http://cloudmanic.com/blog/thanks-for-a-great-2011,robertlendrum,1,0,2011-12-30 18:55:26+00:00,1325271326,,"story, author_robertlendrum, story_3408648",https://news.ycombinator.com/item?id=3408648
3408650,Grifoo simplifies pricing strategy for event producers,http://andesbeat.com/2011/12/30/grifoo-simplifies-pricing-strategy-for-event-producers/,clb22,1,0,2011-12-30 18:55:33+00:00,1325271333,,"story, author_clb22, story_3408650",https://news.ycombinator.com/item?id=3408650
3408668,"Camelot - an open source framework for Python, Sqlalchemy and Qt",http://www.python-camelot.com/,rbanffy,1,0,2011-12-30 19:00:07+00:00,1325271607,,"story, author_rbanffy, story_3408668",https://news.ycombinator.com/item?id=3408668
3408673,Changes to Come: 9 Past Predictions for Funky 70s Tech,http://gajitz.com/changes-to-come-9-past-predictions-for-funky-70s-tech/,russell,2,0,2011-12-30 19:01:00+00:00,1325271660,,"story, author_russell, story_3408673",https://news.ycombinator.com/item?id=3408673
3408674,"Pewen Collector, is the first Mapuche inspired game available in the App Store",http://andesbeat.com/2011/12/29/pewen-collector-mapuche-inspired-game-is-now-available-in-the-app-store/,clb22,1,0,2011-12-30 19:01:42+00:00,1325271702,,"story, author_clb22, story_3408674",https://news.ycombinator.com/item?id=3408674
3408675,Idea to paying customers in 7 weeks: how we did it,http://blog.bufferapp.com/idea-to-paying-customers-in-7-weeks-how-we-did-it,llambda,2,0,2011-12-30 19:02:00+00:00,1325271720,,"story, author_llambda, story_3408675",https://news.ycombinator.com/item?id=3408675
3408676,Pennebaker discusses language and psychological states w/ ref to Twitter,http://www.analyzewords.com/index.php,denzil_correa,1,0,2011-12-30 19:03:05+00:00,1325271785,"What does AnalyzeWords do?
AnalyzeWords helps reveal your personality by looking at how you use words. It is based on good scientific research connecting word use to who people are. So go to town - enter your Twitter name or the handles of friends, lovers, or Hollywood celebrities to learn about their emotions, social styles, and the ways they think.","story, author_denzil_correa, story_3408676",https://news.ycombinator.com/item?id=3408676
3408684,Assign users and labels with commit messages on Github,https://github.com/bluescripts/github-postcommit-shinies,namidark,2,0,2011-12-30 19:04:17+00:00,1325271857,,"story, author_namidark, story_3408684",https://news.ycombinator.com/item?id=3408684
