id,title,url,author,points,num_comments,created_at,created_at_i,story_text,tags,hn_url
2056565,Ask HN:  Replace submission voting in HN by Google-style AI Challenges?,,amichail,2,6,2010-12-31 21:54:59+00:00,1293832499,"Instead of voting on submissions, why not have a weekly AI challenge whereby people making submissions would also submit code for the challenge?  As the week progresses, you can improve your code, even for submissions already made.<p>The ranking of the front page of submissions would be based on the ranking of the associated programs for the AI challenge.  Points gained by your AI program would be divided by the number of submissions associated with that program.<p>The AI challenge setup would be similar to the Google one:  http://ai-contest.com/<p>What do you think?","story, author_amichail, story_2056565, ask_hn",https://news.ycombinator.com/item?id=2056565
2056567,Why We Procrastinate,http://www.psychologytoday.com/articles/200308/stand-and-deliver,evac,3,0,2010-12-31 21:55:08+00:00,1293832508,,"story, author_evac, story_2056567",https://news.ycombinator.com/item?id=2056567
2056570,Why We Make New Year’s Resolutions,http://psychcentral.com/blog/archives/2010/12/28/why-we-make-new-years-resolutions/,evac,1,0,2010-12-31 21:57:07+00:00,1293832627,,"story, author_evac, story_2056570",https://news.ycombinator.com/item?id=2056570
2056587,Reverse Engineering the MOS 6502 CPU,http://www.youtube.com/watch?v=HW9AWBFH1sA&feature=&p=5396743D539B7755&index=0&playnext=1,psykotic,4,0,2010-12-31 22:03:43+00:00,1293833023,,"story, author_psykotic, story_2056587",https://news.ycombinator.com/item?id=2056587
2056601,"Ask HN: Something like OnLive, but for general computing?",,markchristian,1,1,2010-12-31 22:12:14+00:00,1293833534,"Have you guys seen OnLive yet? It's pretty magical: you install a small client on your PC or Mac, and you can play any game from an extensive library. The catch is that the games are running out in the cloud somewhere, and the OnLive client is basically a remote desktop connection optimized for low latency. I'm not much of a gamer, but it's pretty mind boggling to use, just for the sake of the neat tech.<p>So, my question is, are there any services out there that can offer something similar for general desktop computing? I realize I could probably run an EC2 instance and use RDC, but I'd like sound and video to work fluidly.<p>Advice? Thoughts? Recommendations?<p>Happy New Year!","story, author_markchristian, story_2056601, ask_hn",https://news.ycombinator.com/item?id=2056601
2056616,There isn't really much of a tablet market ,http://www.marco.org/2546655554,yewweitan,40,72,2010-12-31 22:18:30+00:00,1293833910,,"story, author_yewweitan, story_2056616",https://news.ycombinator.com/item?id=2056616
2056626,WakeMate sleep-aid recalled due to 'exploding' USB charger,http://www.engadget.com/2010/12/31/wakemate-sleep-aid-recalled-due-to-exploding-usb-charger-give/,shawndumas,1,0,2010-12-31 22:21:14+00:00,1293834074,,"story, author_shawndumas, story_2056626",https://news.ycombinator.com/item?id=2056626
2056629,Github 404 page,https://github.com/404,config_yml,192,43,2010-12-31 22:21:29+00:00,1293834089,,"story, author_config_yml, story_2056629",https://news.ycombinator.com/item?id=2056629
2056630,Can't Find a Technical Co-Founder? Do It Yourself,http://viniciusvacanti.com/2010/09/13/cant-find-a-technical-co-founder-do-it-yourself/,evac,2,0,2010-12-31 22:21:37+00:00,1293834097,,"story, author_evac, story_2056630",https://news.ycombinator.com/item?id=2056630
2056638,What is a netstring?,http://www.willmcgugan.com/blog/tech/2008/1/19/netstring-theory/,gnosis,1,0,2010-12-31 22:23:02+00:00,1293834182,,"story, author_gnosis, story_2056638",https://news.ycombinator.com/item?id=2056638
2056640,Introduction to Electronic Literature: a freeware guide,http://www.arras.net/fscIII/?p=1653,jamesbritt,1,0,2010-12-31 22:24:16+00:00,1293834256,,"story, author_jamesbritt, story_2056640",https://news.ycombinator.com/item?id=2056640
2056659,When people with partial knowledge start talking about college costs,http://jseliger.com/2010/12/31/what-happens-when-people-with-partial-knowledge-start-talking-about-college-costs-in-arizona-and-elsewhere/,jseliger,1,0,2010-12-31 22:32:05+00:00,1293834725,,"story, author_jseliger, story_2056659",https://news.ycombinator.com/item?id=2056659
2056663,Enabling the Tip Calculator in Your Brain,http://www.sellsbrothers.com/Posts/Details/12696,csells,1,0,2010-12-31 22:33:34+00:00,1293834814,,"story, author_csells, story_2056663",https://news.ycombinator.com/item?id=2056663
2056666,10 Online Tools for Better Attention & Focus,http://the99percent.com/articles/6969/10-Online-Tools-for-Better-Attention-Focus,jamesbritt,7,0,2010-12-31 22:35:14+00:00,1293834914,,"story, author_jamesbritt, story_2056666",https://news.ycombinator.com/item?id=2056666
2056696,"Get Ready for More Clever Domain Names, .ng Domains Are a Go",http://www.maximumpc.com/article/news/get_ready_more_clever_domain_names_ng_domains_are_go,zoowar,10,8,2010-12-31 22:51:05+00:00,1293835865,,"story, author_zoowar, story_2056696",https://news.ycombinator.com/item?id=2056696
2056700,MIT Launches Phone-Enabled Work Site for Haiti,http://www.readwriteweb.com/archives/mit_launches_phone-enabled_work_site.php?sms_ss=hackernews&at_xt=4d1e5ed5518a67ee%2C0,curthopkins,1,0,2010-12-31 22:53:12+00:00,1293835992,,"story, author_curthopkins, story_2056700",https://news.ycombinator.com/item?id=2056700
2056709,I can help you realize your startup idea,http://twoinacrowd.com/dates/i-can-help-you-realize-your-startup-idea,vantran,19,5,2010-12-31 22:57:36+00:00,1293836256,,"story, author_vantran, story_2056709",https://news.ycombinator.com/item?id=2056709
2056722,IT organizations considered harmful,http://antipatter.com/2009/08/i-t-organizations-considered-harmful/,kiddo,2,0,2010-12-31 23:03:58+00:00,1293836638,,"story, author_kiddo, story_2056722",https://news.ycombinator.com/item?id=2056722
2056730,Ask HN: Non-profits looking for volunteer developers?,,reasonattlm,16,14,2010-12-31 23:10:30+00:00,1293837030,"In theory, developers should be able to do great things for non-profits. In practice, it seems hard for a developer with spare time to find a non-profit to work with. Somewhat nuts considering that the open source community has plenty of experience with all the issues of volunteering, distributed teams, etc, and there are some great teams out there - hundreds or thousands of developers willing to put in time over the long term to help advance good causes with their skills.<p>So treat this as a who's hiring post, more or less, but for non-profit volunteering with technical skills.<p>(A thought on the issues: reliability is the key, central value needed for a technical volunteer. In any non-profit, volunteers come and volunteers go, but it is very challenging to find people who follow through on a commitment to stay for a given project, or to act as support for a non-profit site for the necessary months and years to build up familiarity with the systems used. When it comes to technology, those rare few are absolutely necessary, however - you simply can't run a tight ship if developers flake out on a regular basis. This is especially true when it comes to projects wherein the team is scattered across the US or the world, and rarely meets in person).<p>My ulterior motive: I get to tack my search for a LAMP developer volunteer for the very hip Methuselah Foundation in here an early comment.","story, author_reasonattlm, story_2056730, ask_hn",https://news.ycombinator.com/item?id=2056730
2056732,Cortex for Google Chrome Solves One of Social Media's Big Problems,http://www.fastcodesign.com/1662856/cortex-for-the-chrome-browser-solves-one-of-social-medias-big-problems,jprim,2,1,2010-12-31 23:11:29+00:00,1293837089,,"story, author_jprim, story_2056732",https://news.ycombinator.com/item?id=2056732
2056762,How do I find a partner?,,stanmancan,6,9,2010-12-31 23:26:27+00:00,1293837987,"I'm a junior web developer, more out of interest than actually being very good at it though. I know it's not a life time career for myself, but I enjoy the challenges and thought process that comes along with it.<p>I feel like there isn't much I can't do, or figure out, but most the time I'm just slow at it, which is where I run into trouble. I have lots of great ideas, but I tend to lose interest and give up after being discouraged when progress seems to be slowing.<p>I've always wanted to find somebody I can trust and rely on, and relay my idea's to so that if they believe in the idea as well, we can work on it together and actually get something launched. My problem though tends to be that I've never been able to find anybody, and wouldn't even know where to start looking (That's a lie, I have one friend but he's in high demand and despite showing interest in many ideas, he's too busy working with another startup and contract work).<p>So HN, any tips?","story, author_stanmancan, story_2056762, ask_hn",https://news.ycombinator.com/item?id=2056762
2056770,Want to get your kids into college? Let them play,http://www.cnn.com/2010/OPINION/12/29/christakis.play.children.learning/index.html,kingsidharth,1,0,2010-12-31 23:28:42+00:00,1293838122,,"story, author_kingsidharth, story_2056770",https://news.ycombinator.com/item?id=2056770
2056771,How To: Your Get Your Old PC Running Like New Again,http://mashable.com/2010/12/31/speed-up-computer/,kingsidharth,1,0,2010-12-31 23:28:46+00:00,1293838126,,"story, author_kingsidharth, story_2056771",https://news.ycombinator.com/item?id=2056771
2056776,Ask HN: What New Year's resolutions do you remember making as a kid?,,solipsist,1,1,2010-12-31 23:30:46+00:00,1293838246,,"story, author_solipsist, story_2056776, ask_hn",https://news.ycombinator.com/item?id=2056776
2056777,Ask HN: Thinking about changing business model,,nicholasreed,4,5,2010-12-31 23:31:14+00:00,1293838274,"I built a scheduling program for businesses in a niche market (~1000 potential customers) that now has 4 customers that each pay ~$300 per month. While current customers love the product (saves time/money, very simple to use, selling point to their monthly customers), attracting new clients has proven very difficult. For every prospect I have talked to, they say that price is the only obstacle. These customers are operating on a ""very thin"" budget and I am having tremendous difficulty convincing new clients to sign up.<p>So, I am looking into switching from a subscription model to an ad-supported one so more clients will sign up. I assume my per-customer revenue/profit would go down, but my increased customer base would overall make me more money. But, I have no idea how conversion rates work.<p>Does anyone have estimates on what the following data would be able to produce for monthly advertising income?<p>Monthly averages (total, not per customer):<p>72k pageviews<p>48k unique pageviews<p>9k visits<p>2k users<p>7.92 pages/visit<p>3 min average time on site","story, author_nicholasreed, story_2056777, ask_hn",https://news.ycombinator.com/item?id=2056777
2056783,Report: iPad will grow 250% in 2011 at the expense of PCs,http://iphone.appleinsider.com/articles/10/12/31/report_ipad_will_grow_250_in_2011_at_the_expense_of_pcs.html,evo_9,2,0,2010-12-31 23:33:43+00:00,1293838423,,"story, author_evo_9, story_2056783",https://news.ycombinator.com/item?id=2056783
2056806,Evil.js,https://github.com/kitgoncharov/evil.js,jgv,2,0,2010-12-31 23:45:51+00:00,1293839151,,"story, author_jgv, story_2056806",https://news.ycombinator.com/item?id=2056806
2056808,The Problem With Home,http://www.azarask.in/blog/post/the-problem-with-home/,solipsist,2,0,2010-12-31 23:47:59+00:00,1293839279,,"story, author_solipsist, story_2056808",https://news.ycombinator.com/item?id=2056808
2056817,45 awesome things I came across in 2010,http://nquo.posterous.com/45-awesome-things-i-came-across-in-2010-0,nQuo,3,0,2010-12-31 23:51:30+00:00,1293839490,,"story, author_nQuo, story_2056817",https://news.ycombinator.com/item?id=2056817
2056823,R2-D2 creator Grant McCune dies,http://www.cbc.ca/arts/film/story/2010/12/30/grant-mccune-obit.html,Mithrandir,23,6,2010-12-31 23:55:10+00:00,1293839710,,"story, author_Mithrandir, story_2056823",https://news.ycombinator.com/item?id=2056823
3405094,"Dear MG Siegler, Are you seriously upset about your photo?",https://plus.google.com/112063946124358686266/posts/SMhmTHjuRuu,zeppelin_7,187,131,2011-12-29 19:57:29+00:00,1325188649,,"story, author_zeppelin_7, story_3405094",https://news.ycombinator.com/item?id=3405094
3405099,Anti-statistical statistic,http://junkcharts.typepad.com/numbersruleyourworld/2011/11/the-most-anti-statistical-statistic-courtesy-of-kristof.html,ranit8,1,0,2011-12-29 19:57:44+00:00,1325188664,,"story, author_ranit8, story_3405099",https://news.ycombinator.com/item?id=3405099
3405104,"Verizon: $2 per online, phone credit card bill payment",http://www.usatoday.com/money/companies/story/2011-12-29/verizon-wireless-2-fee/52271340/1,warmfuzzykitten,1,0,2011-12-29 19:58:14+00:00,1325188694,,"story, author_warmfuzzykitten, story_3405104",https://news.ycombinator.com/item?id=3405104
3405109,HTC releases tool to unlock bootloaders on its devices,http://arstechnica.com/gadgets/news/2011/12/htc-has-released-a-tool.ars,FluidDjango,1,0,2011-12-29 19:59:22+00:00,1325188762,,"story, author_FluidDjango, story_3405109",https://news.ycombinator.com/item?id=3405109
3405115,Superman Origins,http://arstechnica.com/gaming/news/2011/12/exclusive-preview-retelling-supermans-origin-story-in-action-comics-no-5.ars?utm_source=feedburner&utm_medium=feed&utm_campaign=Feed%3A+arstechnica%2Findex+%28Ars+Technica+-+Featured+Content%29,3lit3H4ck3r,2,0,2011-12-29 20:00:11+00:00,1325188811,,"story, author_3lit3H4ck3r, story_3405115",https://news.ycombinator.com/item?id=3405115
3405116,"Namecheap drops ""morality"" clause in ToS",https://twitter.com/Namecheap/status/152459333635014657,zacwest,1,0,2011-12-29 20:00:15+00:00,1325188815,,"story, author_zacwest, story_3405116",https://news.ycombinator.com/item?id=3405116
3405119,What Happened to My Country?,http://www.ritholtz.com/blog/2011/12/what-happened-to-my-country,8bitliving,9,5,2011-12-29 20:00:29+00:00,1325188829,,"story, author_8bitliving, story_3405119",https://news.ycombinator.com/item?id=3405119
3405125,Samira the Girl in the Bubble - Pure HTML5 game,http://www.scirra.com/arcade/puzzle/144/samira-the-girl,TomGullen,3,1,2011-12-29 20:02:29+00:00,1325188949,,"story, author_TomGullen, story_3405125",https://news.ycombinator.com/item?id=3405125
3405130,Ask HN: Possible to take automatic screenshot of webpage at same time each day?,,bengalu,7,8,2011-12-29 20:04:27+00:00,1325189067,Need to get a screen shot of a web page at the same time every day to track some stats for my company. Unfortunately I'm asleep at that point every day. Any way to automate this? Looking for a solution for Mac OS.,"story, author_bengalu, story_3405130, ask_hn",https://news.ycombinator.com/item?id=3405130
3405136,Quora comparison... really?,http://www.horizoncareservices.com/online-question-answer-resource-health-care-florida,fypomg,1,2,2011-12-29 20:07:05+00:00,1325189225,,"story, author_fypomg, story_3405136",https://news.ycombinator.com/item?id=3405136
3405140,Get Off The Popular Train With Freeform Radio,http://cacciatc.github.com/other/2011/12/29/get-off-the-popular-train.html,cacciatc,1,0,2011-12-29 20:07:35+00:00,1325189255,,"story, author_cacciatc, story_3405140",https://news.ycombinator.com/item?id=3405140
3405144,An Internet without marketing advertisements. Is it possible?,,p0wn3d,1,1,2011-12-29 20:08:30+00:00,1325189310,"Remember back in the 70's and 80's before cable TV? We only had channels 3,6, and 7. We loved TV but couldn't stand the commercials every 5 minutes. The internet has turned into one big TV commercial. Websites are now 10% content and 90% ads. It is so sad that we let this get out of control. Don't get me started on social networking and how they exist to be the big TV commercial just to make boatloads of cash.","story, author_p0wn3d, story_3405144, ask_hn",https://news.ycombinator.com/item?id=3405144
3405146,ALearningaDay Book Oscars: The 5 Books of 2011,http://www.alearningaday.com/2011/12/alearningaday-book-oscars-5-books-of.html,rrohan189,2,0,2011-12-29 20:08:40+00:00,1325189320,,"story, author_rrohan189, story_3405146",https://news.ycombinator.com/item?id=3405146
3405149,Scans online of 50 Ron Paul newsletters,http://www.mrdestructo.com/2011/12/game-over-scans-of-over-50-ron-paul.html,noduerme,2,0,2011-12-29 20:09:02+00:00,1325189342,,"story, author_noduerme, story_3405149",https://news.ycombinator.com/item?id=3405149
3405197,Princeton Brews Trouble for Us 1 Percenters: Michael Lewis,http://finance.yahoo.com/news/princeton-brews-trouble-us-1-000000782.html,8bitliving,1,0,2011-12-29 20:19:58+00:00,1325189998,,"story, author_8bitliving, story_3405197",https://news.ycombinator.com/item?id=3405197
3405215,Do Hard Things,http://sealedabstract.com/rants/do-hard-things/,jcsalterego,22,0,2011-12-29 20:25:27+00:00,1325190327,,"story, author_jcsalterego, story_3405215",https://news.ycombinator.com/item?id=3405215
3405239,Thoughts on burnout,http://nickswan.net/2011/12/29/thoughts-on-burnout/,nickswan,2,0,2011-12-29 20:29:18+00:00,1325190558,,"story, author_nickswan, story_3405239",https://news.ycombinator.com/item?id=3405239
3405268,Corporate stereotypes,http://mattswanson.org/corporate-stereotypes-and-why-microsoft-could-kill-your-startup-career/,sorenbs,3,0,2011-12-29 20:35:19+00:00,1325190919,,"story, author_sorenbs, story_3405268",https://news.ycombinator.com/item?id=3405268
3405317,"Go Daddy: Never Mind That SOPA Thing, Look at Naked Danica Patrick",http://allthingsd.com/20111228/go-daddy-never-mind-that-sopa-thing-look-at-danica-patrick/,coolpixar,6,0,2011-12-29 20:45:20+00:00,1325191520,,"story, author_coolpixar, story_3405317",https://news.ycombinator.com/item?id=3405317
3405318,Forgetting is Key to a Healthy Mind,http://www.scientificamerican.com/article.cfm?id=trying-to-forget,rblion,11,7,2011-12-29 20:45:23+00:00,1325191523,,"story, author_rblion, story_3405318",https://news.ycombinator.com/item?id=3405318
3405321,A look at the average Android user [infographic],http://www.bgr.com/2011/12/29/a-look-at-the-average-android-user-infographic/,zacharye,2,0,2011-12-29 20:46:02+00:00,1325191562,,"story, author_zacharye, story_3405321",https://news.ycombinator.com/item?id=3405321
3405324,Ministry of Defence forced to update its war games for Xbox generation,http://www.guardian.co.uk/uk/2011/dec/28/ministry-defence-war-games-xbox,DanBC,2,0,2011-12-29 20:47:49+00:00,1325191669,,"story, author_DanBC, story_3405324",https://news.ycombinator.com/item?id=3405324
3405330,Free implementation of Heroes of the Might and Magic II engine with source code,http://sourceforge.net/projects/fheroes2/files/fheroes2/,zeratul,78,12,2011-12-29 20:49:25+00:00,1325191765,,"story, author_zeratul, story_3405330",https://news.ycombinator.com/item?id=3405330
3405338,Google+ Censoring Borderline Offensive Profile Images,http://marketingland.com/google-now-censoring-borderline-offensive-google-images-2287,ivoflipse,1,0,2011-12-29 20:52:00+00:00,1325191920,,"story, author_ivoflipse, story_3405338",https://news.ycombinator.com/item?id=3405338
3405341,"Ask HN: Recommended ""read-later"" service?",,hnthrowaway321,5,9,2011-12-29 20:52:37+00:00,1325191957,"Like Readability, Instapaper, etc. Please mention your experiences (pros/cons) or link to previous discussion on HN.","story, author_hnthrowaway321, story_3405341, ask_hn",https://news.ycombinator.com/item?id=3405341
3405348,How to Survive Your First Year As An Entrepreneur,http://techcrunch.com/2011/12/29/how-to-survive-your-first-year-as-an-entrepreneur/,sbashyal,84,9,2011-12-29 20:54:55+00:00,1325192095,,"story, author_sbashyal, story_3405348",https://news.ycombinator.com/item?id=3405348
3405360,Goverment won't listen if only .0014 percent of domains leave Godaddy,http://www.itworld.com/internet/236843/no-matter-what-happens-sopa-godaddys-troubles-are-just-beginning,jfaucett,1,0,2011-12-29 20:57:51+00:00,1325192271,,"story, author_jfaucett, story_3405360",https://news.ycombinator.com/item?id=3405360
3405366,Dropbox: the new file system of the web,http://collaborable.com/blog/dropbox-the-new-file-system-of-the-web,ericingram,98,60,2011-12-29 21:00:57+00:00,1325192457,,"story, author_ericingram, story_3405366",https://news.ycombinator.com/item?id=3405366
3405376,How we track API requests with MixPanel and Gearman,http://blog.nodesocket.com/how-we-tracking-api-requests-with-mixpanel-an,nodesocket,21,3,2011-12-29 21:02:24+00:00,1325192544,,"story, author_nodesocket, story_3405376",https://news.ycombinator.com/item?id=3405376
3405386,Shortsighted mix of tech and politics,http://www.betabeat.com/2011/12/29/sopa-supporter-paul-ryan-r-wi-on-track-to-be-first-politician-brought-down-by-reddit/,FormStorm,1,0,2011-12-29 21:04:10+00:00,1325192650,,"story, author_FormStorm, story_3405386",https://news.ycombinator.com/item?id=3405386
3405411,North Korea not the only offender: 6 official photo fudgings,http://www.csmonitor.com/World/Global-Issues/2011/1229/North-Korea-not-the-only-offender-6-official-photo-fudgings/North-Korea-s-chronic-photoshopping,zoowar,2,2,2011-12-29 21:12:40+00:00,1325193160,,"story, author_zoowar, story_3405411",https://news.ycombinator.com/item?id=3405411
3405416,Godaddy is the new AltaVista,http://www.webcontentsolutions.com/openlettertogodaddy.html,wbienek,2,0,2011-12-29 21:13:41+00:00,1325193221,"(Emailed to GoDaddy CEO and GoDaddy PR earlier today as an Open Letter)<p>Dear CEO,<p>You're under attack and the only reason I am not moving my domain names because of a salesman name ""Ron"" (and the fact that nobody else can host domains below 8$).<p>You can look up my customer number (wbienek@gmail.com) and see that I have about 250 domain names.  If NameCheap.com gets smart and gets their domain name renewals at or below $8 dollars a year..  You're toast!<p>You may not remember this, but AltaVista used to be king of the hill before Google came along.<p>--- --- --- --- --- --- --- --- 
Godaddy may be the new ""AltaVista""
--- --- --- --- --- --- --- ---<p>You really seem to be trying to screw the people that hold the keys to your kingdom!  IE : Your customers!!<p>You guys have actively decided to be a part (support SOPA) of people who are against your customers: The RIAA and MPAA<p>I can appreciate your CEO and top brass wanting to rub elbows with the beautiful ""Maxim""/Hollywood crowd, but the geeks who have elevated you will crush you pretty quickly if you go against them - a la Alta Vista!<p>It seems you have decided to go against their core interests!!  Simply releasing a letter saying you're not for SOPA is not enough since you helped DRAFT] SOPA!  You should FIRE the lawyer who helped draft SOPA and run COMMERCIALS against it!<p>You seem to like super bowl commercials..<p>This is a GREAT OPPORTUNITY FOR YOU!<p><i></i> Run a Super Bowl Commercial against SOPA! <i></i><p>January Super Bowl is Coming..<p>You'll reverse your fortune in one fell swoop!<p>Here is my story:<p>I created a real estate website that has zebra stripes.  http://www.kendallsellsmore.com<p>Another web design company used a different set of zebra stripes<p>I bought mine from IStockPhoto--Completely legit..<p>My client's website was taken down for about seven days while I disputed the DMCA takedown notice because one of my competitors had a different set of zebra stripes on their website!<p>What you're doing/supporting is making it so that anyone, for any reason, can complain and take down a website that they don 't like!<p>You're adding to the problem, which is the DMCA, which is already bad enough as it is!<p>Regular people (web designers) are already affected by these stupid a<i></i> laws that are already on the books, and you want to add MORE?!?!!<p>It is not only about movies and music - It's about anyone filing a complaint for any reason for anything and then putting us web designers out of business!<p>We can't afford to fight people complaining that they don't like competition..<p>Here you go..<p>www.kendallsellsmore.com vs www.lynnekelleher.com<p>My site : KendallSellsMore was taken off line!  This is what you have to look forward to!<p>We WebMasters are the reason why you are in business!! recourse<p>Here is the actual letter I used  ( Feel free to use this as you're template ) to have the site re-instated!  This is BS that I had my client's website pulled down over this!!  Jealous competitors can have your site pulled down on a whim!<p>http://www.webcontentsolutions.com/bs-dmca.jpg<p>Wayne Bienek
Owner of : www.webcontentsolutions.com
#1 Google for : Real Estate Web Design<p>Designing Real Estate Sites for over 11 years!","story, author_wbienek, story_3405416",https://news.ycombinator.com/item?id=3405416
3405417,"Good Luck Occupiers, But Here’s Why “Facebook For Protesters” Won’t Work",http://techcrunch.com/2011/12/29/occupy-facebook/,FluidDjango,2,0,2011-12-29 21:13:42+00:00,1325193222,,"story, author_FluidDjango, story_3405417",https://news.ycombinator.com/item?id=3405417
3405419,"DVCS-autosync, a free Dropbox alternative",https://lwn.net/Articles/442841/,brdrak,6,0,2011-12-29 21:14:37+00:00,1325193277,,"story, author_brdrak, story_3405419",https://news.ycombinator.com/item?id=3405419
3405425,Censored Godadday article,http://www.csmonitor.com/Business/2011/1229/Boycott-of-GoDaddy-over-SOPA-bill-a-barometer-of-Internet-politics,_wp3r,1,0,2011-12-29 21:15:57+00:00,1325193357,,"story, author__wp3r, story_3405425",https://news.ycombinator.com/item?id=3405425
