id,title,url,author,points,num_comments,created_at,created_at_i,story_text,tags,hn_url
2049477,How to Design Programs: An Introduction to Computing and Programming,http://htdp.org/2003-09-26/Book/,zoowar,121,17,2010-12-29 17:40:23+00:00,1293644423,,"story, author_zoowar, story_2049477",https://news.ycombinator.com/item?id=2049477
2049479,Forged in the Stars - a love letter to NASA,http://www.loe.org/shows/segments.htm?programID=09-P13-00052&segmentID=1,limist,1,0,2010-12-29 17:40:29+00:00,1293644429,,"story, author_limist, story_2049479",https://news.ycombinator.com/item?id=2049479
2049481,"North American English Dialects, Based on Pronunciation Patterns",http://aschmann.net/AmEng/#Southern,eggspurt,2,1,2010-12-29 17:41:20+00:00,1293644480,,"story, author_eggspurt, story_2049481",https://news.ycombinator.com/item?id=2049481
2049484,Pinboard.In Architecture - Pay To Play To Keep A System Small  ,http://highscalability.com/blog/2010/12/29/pinboardin-architecture-pay-to-play-to-keep-a-system-small.html,yarapavan,6,0,2010-12-29 17:42:06+00:00,1293644526,,"story, author_yarapavan, story_2049484",https://news.ycombinator.com/item?id=2049484
2049496,Why your child's school bus has no seat belts,http://www.msnbc.msn.com/id/40820669/ns/us_news-life/,thedoctor,171,104,2010-12-29 17:45:24+00:00,1293644724,,"story, author_thedoctor, story_2049496",https://news.ycombinator.com/item?id=2049496
2049511,2011 is year of the Server-Side JavaScript,http://labnotes.org/2010/12/29/2011-is-year-of-the-server-side-javascript/,joshuacc,14,3,2010-12-29 17:49:58+00:00,1293644998,,"story, author_joshuacc, story_2049511",https://news.ycombinator.com/item?id=2049511
2049527,Media Temple introduces ProCDN,http://weblog.mediatemple.net/2010/12/28/introducing-procdn-content-delivery-network/,joshuacc,1,1,2010-12-29 17:54:37+00:00,1293645277,,"story, author_joshuacc, story_2049527",https://news.ycombinator.com/item?id=2049527
2049535,How A Student Won $1 Defending A Facebook Rant For 2 Years,http://fastgush.com/all-fun/how-a-student-won-1-defending-a-facebook-rant-for-2-years.html,shashank261,1,0,2010-12-29 17:56:00+00:00,1293645360,,"story, author_shashank261, story_2049535",https://news.ycombinator.com/item?id=2049535
2049537,3 Startup Payments Predictions for 2011,http://techcocktail.com/startup-payments-predictions-2010-12,FrankGruber5,3,1,2010-12-29 17:56:17+00:00,1293645377,,"story, author_FrankGruber5, story_2049537",https://news.ycombinator.com/item?id=2049537
2049543,Multifamily households in US jumped 11.7 percent from 2008 to 2010,http://www.nytimes.com/2010/12/29/us/29families.html?_r=1,mcantelon,1,0,2010-12-29 17:58:16+00:00,1293645496,,"story, author_mcantelon, story_2049543",https://news.ycombinator.com/item?id=2049543
2049546,Apple to add USB port to next-generation iPad,http://www.appleinsider.com/articles/10/12/29/apple_to_add_usb_port_to_next_generation_ipad_rumor.html,evo_9,1,1,2010-12-29 17:58:37+00:00,1293645517,,"story, author_evo_9, story_2049546",https://news.ycombinator.com/item?id=2049546
2049547,Software said to match quantum computing speed,http://www.computerworld.com/s/article/9202378/Software_said_to_match_quantum_computing_speed,Husafan,1,0,2010-12-29 17:58:45+00:00,1293645525,,"story, author_Husafan, story_2049547",https://news.ycombinator.com/item?id=2049547
2049548,Statistical analysis: An introduction using R,http://en.wikibooks.org/wiki/Statistical_Analysis:_an_Introduction_using_R,instakill,2,0,2010-12-29 17:58:58+00:00,1293645538,,"story, author_instakill, story_2049548",https://news.ycombinator.com/item?id=2049548
2049549,IPad magazine sales numbers show steep decline over a few short months,http://www.engadget.com/2010/12/29/ipad-magazine-sales-numbers-show-steep-decline-over-a-few-short/,lotusleaf1987,1,0,2010-12-29 17:59:33+00:00,1293645573,,"story, author_lotusleaf1987, story_2049549",https://news.ycombinator.com/item?id=2049549
2049550,TU scientists in Nature: Better control of building blocks for quantum computer,http://www.tudelft.nl/live/pagina.jsp?id=2136915a-f72a-441a-8783-b0b0e91cb48f&lang=en,Husafan,1,0,2010-12-29 17:59:38+00:00,1293645578,,"story, author_Husafan, story_2049550",https://news.ycombinator.com/item?id=2049550
2049551,Meet the Data-Storing Bacteria,http://www.pcworld.com/article/214776/meet_the_datastoring_bacteria.html,Husafan,1,0,2010-12-29 18:00:00+00:00,1293645600,,"story, author_Husafan, story_2049551",https://news.ycombinator.com/item?id=2049551
2049556,Hack Facebook status ,http://www.reddit.com/r/funny/comments/esy7s/holy_shit_reddit_i_have_just_discovered_the/,annim,1,0,2010-12-29 18:02:14+00:00,1293645734,,"story, author_annim, story_2049556",https://news.ycombinator.com/item?id=2049556
2049557,On $100 Android Phones,http://sealedabstract.com/rants/on-100-android-phones/,joshuacc,1,0,2010-12-29 18:02:25+00:00,1293645745,,"story, author_joshuacc, story_2049557",https://news.ycombinator.com/item?id=2049557
2049563,iPad + Velcro,http://www.apple.com/ipad/velcro,jesseendahl,1,0,2010-12-29 18:03:37+00:00,1293645817,,"story, author_jesseendahl, story_2049563",https://news.ycombinator.com/item?id=2049563
2049567,Accidental Minimum Viable Products,http://vlaskovits.com/2010/12/accidental-minimum-viable-products/,joshuacc,3,0,2010-12-29 18:04:09+00:00,1293645849,,"story, author_joshuacc, story_2049567",https://news.ycombinator.com/item?id=2049567
2049568,Obama's campaign agency being acquired by WPP,http://blogs.news.sky.com/kleinman/Post:9e54ed79-6184-40f0-8930-f213ee60727e,jgilliam,2,0,2010-12-29 18:04:36+00:00,1293645876,,"story, author_jgilliam, story_2049568",https://news.ycombinator.com/item?id=2049568
2049577,The smartphone wars: There’s dross in them thar hills,http://esr.ibiblio.org/?p=2839,billswift,1,0,2010-12-29 18:06:06+00:00,1293645966,,"story, author_billswift, story_2049577",https://news.ycombinator.com/item?id=2049577
2049583,Preview: Highrise redesign for 2011,http://productblog.37signals.com/products/2010/12/preview-highrise-redesign-for-2011.html,joshuacc,2,0,2010-12-29 18:07:25+00:00,1293646045,,"story, author_joshuacc, story_2049583",https://news.ycombinator.com/item?id=2049583
2049584,Fedora 15 To Get MySQL 5.5; In Rawhide Already,http://digitizor.com/2010/12/29/fedora-15-lovelock-to-get-mysql-5-5-postgresql-9/,dkd903,2,0,2010-12-29 18:07:51+00:00,1293646071,,"story, author_dkd903, story_2049584",https://news.ycombinator.com/item?id=2049584
2049589,Ka-ching - Pavlovian email alert,http://successfulsoftware.net/2010/12/27/ka-ching/,joshuacc,2,0,2010-12-29 18:09:25+00:00,1293646165,,"story, author_joshuacc, story_2049589",https://news.ycombinator.com/item?id=2049589
2049595,"Google, Apple, Intel Among Best Tech Companies to Work for in 2011",http://www.eweek.com/c/a/IT-Management/Google-Apple-Intel-Among-20-Best-Tech-Companies-to-Work-for-in-2011-467735/?kc=EWKNLCSM12282010STR1,csouth,1,0,2010-12-29 18:10:52+00:00,1293646252,,"story, author_csouth, story_2049595",https://news.ycombinator.com/item?id=2049595
2049623,Scoble interviews Matt Mullenweg,http://ma.tt/2010/12/scoble-interview/,acangiano,2,0,2010-12-29 18:22:33+00:00,1293646953,,"story, author_acangiano, story_2049623",https://news.ycombinator.com/item?id=2049623
2049633,Startup Logos from 2010,http://blog.designcrowd.com/article/243/50-startup-logos-from-2010,davidedicillo,25,18,2010-12-29 18:27:09+00:00,1293647229,,"story, author_davidedicillo, story_2049633",https://news.ycombinator.com/item?id=2049633
2049635,Why Tech Already Has Women (And Why They’re Better Than Arrington),http://dannybrown.me/2010/12/29/women-are-not-techs-bitches/,jdp23,2,0,2010-12-29 18:28:28+00:00,1293647308,,"story, author_jdp23, story_2049635",https://news.ycombinator.com/item?id=2049635
2049637,"How to lose weight: What worked for me, with graphs",http://danieltenner.com/posts/0018-how-to-lose-weight.html,lionhearted,22,35,2010-12-29 18:29:23+00:00,1293647363,,"story, author_lionhearted, story_2049637",https://news.ycombinator.com/item?id=2049637
2049639,Is Computer Science a branch of Mathematics?,,CloudOps42,2,0,2010-12-29 18:31:25+00:00,1293647485,"Is Computer Science math, or a branch of math?  Is it closer to philosophy?<p>How closely tied are Computer Science and Mathematics?<p>My son (15, and a whiz of a programmer/hacker) and I are locked in a discussion of the origins of Computer Science and its ties to Math.<p>Your take?","story, author_CloudOps42, story_2049639, ask_hn",https://news.ycombinator.com/item?id=2049639
2049649,Redis - The Hacker's Database,http://amix.dk/blog/post/19598,taylorbuley,2,0,2010-12-29 18:35:04+00:00,1293647704,,"story, author_taylorbuley, story_2049649",https://news.ycombinator.com/item?id=2049649
2049654,Four Methods to Grow Your Business During the Holidays,http://clicksaw.com/four-methods-to-grow-your-business-during-the-holidays/,clicksaw,2,0,2010-12-29 18:36:18+00:00,1293647778,,"story, author_clicksaw, story_2049654",https://news.ycombinator.com/item?id=2049654
2049663,Unemployment rate hits 10-year peak in 112 U.S. markets,http://www.bizjournals.com/buffalo/news/2010/12/29/jobless-rate-hits-peak-in-30-of-markets.html,chailatte,1,0,2010-12-29 18:38:37+00:00,1293647917,,"story, author_chailatte, story_2049663",https://news.ycombinator.com/item?id=2049663
2049669,About dreamers and naysayers,http://siddharthsarda.posterous.com/about-dreamers-and-naysayers,sid6376,1,0,2010-12-29 18:40:43+00:00,1293648043,,"story, author_sid6376, story_2049669",https://news.ycombinator.com/item?id=2049669
2049674,The best debugging story I've ever heard,http://patrickthomson.tumblr.com/post/2499755681/the-best-debugging-story-ive-ever-heard,henning,23,0,2010-12-29 18:41:29+00:00,1293648089,,"story, author_henning, story_2049674",https://news.ycombinator.com/item?id=2049674
2049675,Losers get punished for trying to lead,http://www.futurity.org/top-stories/losers-get-punished-for-trying-to-lead/,jedwhite,2,0,2010-12-29 18:41:37+00:00,1293648097,,"story, author_jedwhite, story_2049675",https://news.ycombinator.com/item?id=2049675
2049678,Brand Identity Essentials - Kevin Budelmann,http://brand-identity-essentials.com/100-principles,anujkk,1,0,2010-12-29 18:42:18+00:00,1293648138,Excellent resource for Brand Identity Design.,"story, author_anujkk, story_2049678",https://news.ycombinator.com/item?id=2049678
2049680,Coding styles comparison in the Open Source Software world,http://balau82.wordpress.com/2010/12/28/coding-styles-comparison-in-the-open-source-software-world/,bconway,2,0,2010-12-29 18:43:05+00:00,1293648185,,"story, author_bconway, story_2049680",https://news.ycombinator.com/item?id=2049680
2049688,Conspicuous Production,http://worthwhile.typepad.com/worthwhile_canadian_initi/2010/12/conspicuous-production.html,jplewicke,1,0,2010-12-29 18:45:26+00:00,1293648326,,"story, author_jplewicke, story_2049688",https://news.ycombinator.com/item?id=2049688
2049697,"The ""catch"" with try...catch",http://weblog.bocoup.com/the-catch-with-try-catch,brandonkm,2,0,2010-12-29 18:48:30+00:00,1293648510,,"story, author_brandonkm, story_2049697",https://news.ycombinator.com/item?id=2049697
2049698,Long distance relationship? Perl can help.,http://code.google.com/p/serendipity/,mayank,86,20,2010-12-29 18:48:35+00:00,1293648515,,"story, author_mayank, story_2049698",https://news.ycombinator.com/item?id=2049698
2049705,B-School Startups: Internship Sparks WorkerExpress,http://www.businessweek.com/bschools/content/dec2010/bs20101220_792211.htm,10smom,1,0,2010-12-29 18:50:21+00:00,1293648621,,"story, author_10smom, story_2049705",https://news.ycombinator.com/item?id=2049705
2049721,Ask HN: Anybody know a good web-based WYSIWYG HTML editor to integrate?,,lionheart,9,13,2010-12-29 18:57:02+00:00,1293649022,"Hi HN,<p>I've been scouring the Internet looking for a good HTML editor I can integrate into my web app and haven't found anything that actually looks good.<p>Has anybody here had success with finding a good editor and integrating it into their application?<p>I'd appreciate any recommendations.","story, author_lionheart, story_2049721, ask_hn",https://news.ycombinator.com/item?id=2049721
2049737,GWT 2 Spring 3 JPA 2 Hibernate 3.5 Tutorial,http://www.javacodegeeks.com/2010/05/gwt-2-spring-3-jpa-2-hibernate-35.html,javacodegeeks,3,0,2010-12-29 19:01:29+00:00,1293649289,"This step by step guide will present how to develop a simple web application using Google's Web Toolkit (GWT) for the rich client and Spring as the back – end, server side framework. The sample web application will provide functionality to make CRUD (Create Retrieve Update Delete) operations to a database. For the data access layer we will use JPA over Hibernate and for a database we will use Hypersonic. Of course you can change the configuration and use whatever you like. We will deploy the web application to an Apache – Tomcat instance.","story, author_javacodegeeks, story_2049737",https://news.ycombinator.com/item?id=2049737
2049744,The Jeff Minter story,http://minotaurproject.co.uk/lshistory1.php,xd,3,0,2010-12-29 19:03:16+00:00,1293649396,,"story, author_xd, story_2049744",https://news.ycombinator.com/item?id=2049744
2049748,Things Every Programmer Should Know,http://www.javacodegeeks.com/2010/12/things-every-programmer-should-know.html,javacodegeeks,3,0,2010-12-29 19:04:13+00:00,1293649453,"The collection is intended simply to contain multiple and varied perspectives on what it is that contributors to the project feel programmers should know. This can be anything from code-focused advice to culture, from algorithm usage to agile thinking, from implementation know-how to professionalism, from style to substance, etc.<p>In this article we provide a summary of the first 27 ""Things Every Programmer Should Know""!","story, author_javacodegeeks, story_2049748",https://news.ycombinator.com/item?id=2049748
2049757,POLL: Does being over 40 help or hinder a startup Founder?,,10smom,1,4,2010-12-29 19:05:55+00:00,1293649555,,"story, author_10smom, story_2049757, ask_hn",https://news.ycombinator.com/item?id=2049757
2049763,Tell HN: Someone should make a screen capture tool for Chrome,,hajrice,2,2,2010-12-29 19:06:56+00:00,1293649616,"Someone should write a chrome extension/app for the Chrome browser that lets users capture screenshots and upload them onto the internet without any clicks. Click, select and you're done. You get a page with the image along with the link(highlighted at the top with BIG letters) which you can share with your friends.<p>After trying out several different tools, which all pretty much suck, I decided to write up this post, hopefully someone looking for an idea will get inspired. This is a HUGE problem for me and probably millions of other chrome users. The current solutions suck, are way toooo cluttered and do are way to complicated. All users really want to is to capture a portion of the screen and upload it. I don't want to save it on my pc, upload it and share it. It should be very simple.<p>I'm certain that whoever makes a tool like this, and it's fast and is simple could easily charge $0.99 for it.","story, author_hajrice, story_2049763, ask_hn",https://news.ycombinator.com/item?id=2049763
2049765,My 2011 Content Strategy as an Entrepreneur and Startup Founder,http://www.tawheedkader.com/2010/12/my-2011-content-strategy-as-an-entrepreneur-and-startup-founder+/,Tawheed,8,0,2010-12-29 19:07:31+00:00,1293649651,,"story, author_Tawheed, story_2049765",https://news.ycombinator.com/item?id=2049765
2049766,Zipping with applicative functors in F#,http://bugsquash.blogspot.com/2010/12/zipping-with-applicative-functors-in-f.html,gcampbell,2,0,2010-12-29 19:07:38+00:00,1293649658,,"story, author_gcampbell, story_2049766",https://news.ycombinator.com/item?id=2049766
2049767,Voice Search for Chrome Searches and Fills Input Boxes with Your Voice,http://lifehacker.com/5720334/voice-search-for-chrome-searches-and-fills-input-boxes-with-your-voice,liuhenry,1,0,2010-12-29 19:07:43+00:00,1293649663,,"story, author_liuhenry, story_2049767",https://news.ycombinator.com/item?id=2049767
2049777,Richard Dawkins on his lifelong love of the King James Bible,http://www.newstatesman.com/religion/2010/12/king-james-bible-poetry-shall,Umalu,15,0,2010-12-29 19:09:48+00:00,1293649788,,"story, author_Umalu, story_2049777",https://news.ycombinator.com/item?id=2049777
2049787,Floyd Abrams: Why WikiLeaks Is Unlike the Pentagon Papers,http://online.wsj.com/article/SB10001424052970204527804576044020396601528.html,jedwhite,2,0,2010-12-29 19:11:07+00:00,1293649867,,"story, author_jedwhite, story_2049787",https://news.ycombinator.com/item?id=2049787
2049788,Efficient way to get files off the page cache,http://glandium.org/blog/?p=1262,mattyb,1,0,2010-12-29 19:11:30+00:00,1293649890,,"story, author_mattyb, story_2049788",https://news.ycombinator.com/item?id=2049788
2049800,Speech in the Home,http://www.forbes.com/2010/12/21/human-speechome-mit-media-lab-children-language-acquisition.html,chegra,2,0,2010-12-29 19:14:02+00:00,1293650042,,"story, author_chegra, story_2049800",https://news.ycombinator.com/item?id=2049800
2049811,"The Software Manager's ""Joel Test""",http://www.adayinthelifeof.nl/2010/12/18/tutorial-how-to-manage-developers/,vlucas,24,7,2010-12-29 19:17:21+00:00,1293650241,,"story, author_vlucas, story_2049811",https://news.ycombinator.com/item?id=2049811
2049829,Using statistics to detect cheaters,http://www.pittsburghpostgazette.com/pg/10361/1113930-298.stm,ubasu,1,0,2010-12-29 19:23:03+00:00,1293650583,,"story, author_ubasu, story_2049829",https://news.ycombinator.com/item?id=2049829
2049831,Hammock Driven Development Cheat Sheet,http://data-sorcery.org/2010/12/29/hammock-driven-dev/,swannodette,23,0,2010-12-29 19:23:38+00:00,1293650618,,"story, author_swannodette, story_2049831",https://news.ycombinator.com/item?id=2049831
2049836,Show HN: Pomodroido - a pomodoro timer with a side of game mechanics,http://mennoluiten.com/pomodroido-my-pomodoro-timer-with-a-side-of-g,mluiten,4,1,2010-12-29 19:24:19+00:00,1293650659,,"story, author_mluiten, story_2049836, show_hn",https://news.ycombinator.com/item?id=2049836
2049849,Non Persistent XSS with Cookie (yummy),https://github.com/cgcardona/exeses/tree/master/non_persistent_w_cookie,cgcardona,1,0,2010-12-29 19:29:40+00:00,1293650980,,"story, author_cgcardona, story_2049849",https://news.ycombinator.com/item?id=2049849
2049868,The IO monad is 45 years old,http://www.haskell.org/pipermail/haskell-cafe/2010-December/087788.html,yan,4,0,2010-12-29 19:34:35+00:00,1293651275,,"story, author_yan, story_2049868",https://news.ycombinator.com/item?id=2049868
2049870,Journalism in the Age of Data: A Video Report on Data Visualization ,http://datajournalism.stanford.edu/,kqr2,2,0,2010-12-29 19:34:56+00:00,1293651296,,"story, author_kqr2, story_2049870",https://news.ycombinator.com/item?id=2049870
2049871,Looptaggr! A great DIY tool to express your opinion in public. ,http://graffitiprinter.com/make/,fizz972,2,0,2010-12-29 19:34:59+00:00,1293651299,,"story, author_fizz972, story_2049871",https://news.ycombinator.com/item?id=2049871
2049873,Air Force Performing Falcon flies away during bowl game - USAFA Community,http://www.usafacommunity.com/forum/general-afa-discussion/9256-falcon-flies-away-into-wild-blue-yonder.html,10smom,1,2,2010-12-29 19:35:13+00:00,1293651313,,"story, author_10smom, story_2049873",https://news.ycombinator.com/item?id=2049873
2049877,"How to Design Programs, Second Edition",http://www.ccs.neu.edu/home/matthias/HtDP2e/,lackbeard,1,0,2010-12-29 19:36:06+00:00,1293651366,,"story, author_lackbeard, story_2049877",https://news.ycombinator.com/item?id=2049877
2049879,Tanks in the cloud: Computing services are both bigger and smaller than assumed,http://www.economist.com/node/17797794?story_id=17797794&fsrc=rss,yan,2,0,2010-12-29 19:36:13+00:00,1293651373,,"story, author_yan, story_2049879",https://news.ycombinator.com/item?id=2049879
2049880,Top Google Apps in 2010,http://googlesystem.blogspot.com/2010/12/top-google-apps-in-2010.html,abraham,2,0,2010-12-29 19:36:50+00:00,1293651410,,"story, author_abraham, story_2049880",https://news.ycombinator.com/item?id=2049880
2049881,Online dating: Love at first byte,http://www.economist.com/node/17797424?story_id=17797424,yan,3,0,2010-12-29 19:37:00+00:00,1293651420,,"story, author_yan, story_2049881",https://news.ycombinator.com/item?id=2049881
2049882,Ask HN: Recommend book(s) about monetizing a web site/application?,,tripplez,6,2,2010-12-29 19:37:04+00:00,1293651424,"I have a web application in the early development stage. I have a (humble but ambitious) plan to achieve reasonable amounts of traffic compared to the competitor sites or the sites with similar functionalities.<p>Let's assume (fast-forward when version 1.0 of the site is online) that the amount of visitors of the site are according to the plan. Since the functionality offered by the site is completely free, how does one monetize the traffic to the site? And more specifically, are there any books that discuss the general methods/mechanisms for making money out of ""popular"" sites?<p>I've researched for books about monetizing but I've found mostly books about making a product/site popular (something that I <i>humbly</i> assume that is already a fact).<p>Thank you for your time.","story, author_tripplez, story_2049882, ask_hn",https://news.ycombinator.com/item?id=2049882
2049887,WikiLeaks' Imitators Proliferate But Go Their Own Way: A Catalog of Clones,http://www.readwriteweb.com/archives/wikileaks_clone_wars.php?sms_ss=hackernews&at_xt=4d1b8e13b3a47799%2C0,curthopkins,2,0,2010-12-29 19:38:06+00:00,1293651486,,"story, author_curthopkins, story_2049887",https://news.ycombinator.com/item?id=2049887
2049905,Changing Your Life In 2011 - Fitness Hacks,http://brandontreb.com/changing-your-life-in-2011/,brandontreb,7,9,2010-12-29 19:43:27+00:00,1293651807,,"story, author_brandontreb, story_2049905",https://news.ycombinator.com/item?id=2049905
2049908,An alternate and logical way for naming family members,http://vietual.wordpress.com/2010/12/27/2-beyond-vietnam-family-numbering-scheme/,tidbit,2,0,2010-12-29 19:44:09+00:00,1293651849,,"story, author_tidbit, story_2049908",https://news.ycombinator.com/item?id=2049908
2049920,What's the Status of the Verizon iPhone?,http://www.readwriteweb.com/mobile/2010/12/status-of-the-verizon-iphone.php,shawndumas,1,0,2010-12-29 19:48:33+00:00,1293652113,,"story, author_shawndumas, story_2049920",https://news.ycombinator.com/item?id=2049920
2049923,The Wussification of America,http://www.theatlantic.com/politics/archive/2010/12/the-wussification-of-america/68652/,shawndumas,5,2,2010-12-29 19:48:54+00:00,1293652134,,"story, author_shawndumas, story_2049923",https://news.ycombinator.com/item?id=2049923
2049930,Breaking Down the Mormon SEO Strategy,http://www.distilled.co.uk/blog/seo/breaking-down-the-mormon-seo-strategy/,superfamicom,9,0,2010-12-29 19:50:01+00:00,1293652201,"Last week while I was at lunch, I came across this submission on Hacker News about how Avinash discussed the effectiveness of The Church of Jesus Christ of Latter-day Saints‘ SEO. As an SEO, I was naturally interested in their strategy, so I looked deeper. What I found was extremely interesting and a great case study of the power of SEO (and how to do it well)...","story, author_superfamicom, story_2049930",https://news.ycombinator.com/item?id=2049930
2049931,PureDarwin,http://www.puredarwin.org/,DanielRibeiro,2,0,2010-12-29 19:50:15+00:00,1293652215,,"story, author_DanielRibeiro, story_2049931",https://news.ycombinator.com/item?id=2049931
2049937,Show HN: Find gas stations near airports (for rental cars),http://airportgasfinder.com/,aaronbrethorst,1,0,2010-12-29 19:52:51+00:00,1293652371,,"story, author_aaronbrethorst, story_2049937, show_hn",https://news.ycombinator.com/item?id=2049937
2049942,Aim to have no value creation reset clock,https://compversions.posterous.com/aim-to-have-no-value-creation-reset-clock,marcamillion,1,0,2010-12-29 19:56:11+00:00,1293652571,,"story, author_marcamillion, story_2049942",https://news.ycombinator.com/item?id=2049942
2049945,The True Secret of Monkey Island: Designing Successful Adventure Games [pdf],http://www.stanford.edu/group/htgg/sts145papers/cwarren_2003_1.pdf,kitcar,5,0,2010-12-29 19:57:17+00:00,1293652637,,"story, author_kitcar, story_2049945",https://news.ycombinator.com/item?id=2049945
2049952,Brazilian Startup DeskMetrics Raises Seed Round For Desktop Software Analytics,http://techcrunch.com/2010/12/20/brazilian-startup-deskmetrics-raises-seed-round-for-desktop-software-analytics/,alisson,2,0,2010-12-29 20:00:23+00:00,1293652823,,"story, author_alisson, story_2049952",https://news.ycombinator.com/item?id=2049952
2049964,"If your paid service goes down for 24 hours, better to send nothing than this...",http://i.imgur.com/G5znR.png,mmaunder,7,0,2010-12-29 20:02:47+00:00,1293652967,,"story, author_mmaunder, story_2049964",https://news.ycombinator.com/item?id=2049964
2049968,"Xdotool - fake keyboard/mouse input, window management, etc",http://www.semicomplete.com/projects/xdotool/,r11t,3,0,2010-12-29 20:03:21+00:00,1293653001,,"story, author_r11t, story_2049968",https://news.ycombinator.com/item?id=2049968
2049982,Rails 3 Cheat Sheets from Envy Labs,http://blog.envylabs.com/2010/12/rails-3-cheat-sheets/,ludicast,145,9,2010-12-29 20:05:44+00:00,1293653144,,"story, author_ludicast, story_2049982",https://news.ycombinator.com/item?id=2049982
2049991,In praise of iamamiwhoami,http://www.jwz.org/blog/2010/12/in-praise-of-iamamiwhoami/,garret,2,0,2010-12-29 20:09:11+00:00,1293653351,,"story, author_garret, story_2049991",https://news.ycombinator.com/item?id=2049991
