id,title,url,author,points,num_comments,created_at,created_at_i,story_text,tags,hn_url
2052924,"Ask HN: Name for ""photos and video"" section -- not ""multimedia""",,jawns,2,7,2010-12-30 17:49:32+00:00,1293731372,"A section on our homepage features news photos and news video.<p>Under the subheading of ""Photos,"" there are five thumbnails of recent photos.<p>Below that, under the subheading of ""Video,"" there are five thumbnails of recent videos.<p>I need to come up with a headline that encompasses both of those, without merely repeating ""Photos and Video.""<p>""Multimedia"" has already been ruled out.<p>Suggestions?","story, author_jawns, story_2052924, ask_hn",https://news.ycombinator.com/item?id=2052924
2052925,Lend HN: Kindle E-Book Lending thread.,,tejaswiy,2,3,2010-12-30 17:50:04+00:00,1293731404,"So, now that Amazon has enabled lending on the Kindle devices, I thought it'd be a good idea to start a Lend HN thread to swap interesting books. I have a bunch of books that I have on my Amazon account, but the 'Loan this book' option is enabled for just one of them. (The publisher needs to approve this first). I suspect more will become available soon though as Amazon has just rolled this feature.<p>So for my first post:
I have a copy of 'Founders at Work' that I can loan out. Keep in mind that the book can only be loaned out for two weeks at a time. If anyone hasn't read this book yet, please post and I'd be happy to send it out to  you.","story, author_tejaswiy, story_2052925, ask_hn",https://news.ycombinator.com/item?id=2052925
2052928,"Twitter for the greater good: ""I will dig you out.""",http://blog.twitter.com/2010/12/i-will-dig-you-out.html,LiveTheDream,7,1,2010-12-30 17:50:16+00:00,1293731416,,"story, author_LiveTheDream, story_2052928",https://news.ycombinator.com/item?id=2052928
2052930,Spokeo: Not your grandma's phonebook,http://www.spokeo.com/,pierrefar,1,0,2010-12-30 17:50:57+00:00,1293731457,,"story, author_pierrefar, story_2052930",https://news.ycombinator.com/item?id=2052930
2052941,The last unconquered sector of the web,http://seeinginteractive.com/newspaper-support-group/the-webs-final-frontier/,lloydarmbrust,122,47,2010-12-30 17:53:48+00:00,1293731628,,"story, author_lloydarmbrust, story_2052941",https://news.ycombinator.com/item?id=2052941
2052951,Pinax Gets New Project Website,http://pinaxproject.com/blog/2010/12/28/new-website/,jtauber,29,12,2010-12-30 17:55:34+00:00,1293731734,,"story, author_jtauber, story_2052951",https://news.ycombinator.com/item?id=2052951
2052955,Rearrange your registration forms.,http://sahillavingia.com/blog/2010/12/30/rearrange-your-registration-forms/,sahillavingia,15,5,2010-12-30 17:55:53+00:00,1293731753,,"story, author_sahillavingia, story_2052955",https://news.ycombinator.com/item?id=2052955
2052959,Mayor Hacks Snowmageddon With Epic Tweets,http://www.wired.com/epicenter/2010/12/hacking-snowmageddon/,abraham,2,0,2010-12-30 17:56:36+00:00,1293731796,,"story, author_abraham, story_2052959",https://news.ycombinator.com/item?id=2052959
2052967,Show HN: go back in time and get nostalgic about 2010 with rrrewind.com,http://rrrewind.com,earlyriser,22,16,2010-12-30 17:57:46+00:00,1293731866,,"story, author_earlyriser, story_2052967, show_hn",https://news.ycombinator.com/item?id=2052967
2052968,Tips to promote your applications on the web,http://www.davidedicillo.com/marketing/tips-to-promote-your-applications-on-the-web/,roder,2,0,2010-12-30 17:57:54+00:00,1293731874,,"story, author_roder, story_2052968",https://news.ycombinator.com/item?id=2052968
2052975,Knuth's Toilet Paper Problem,http://gi.cebitec.uni-bielefeld.de/teaching/2007summer/jclub/papers/toiletPaper.pdf,fogus,32,10,2010-12-30 17:59:59+00:00,1293731999,,"story, author_fogus, story_2052975",https://news.ycombinator.com/item?id=2052975
2052978,Antenna Power Calculations,http://www.eeweb.com/quiz/antenna-power-calculations,proee,1,0,2010-12-30 18:00:42+00:00,1293732042,,"story, author_proee, story_2052978",https://news.ycombinator.com/item?id=2052978
2052986,The Common Lisp Reader's algorithm,http://www.lispworks.com/documentation/lw50/CLHS/Body/02_b.htm,fogus,31,1,2010-12-30 18:02:12+00:00,1293732132,,"story, author_fogus, story_2052986",https://news.ycombinator.com/item?id=2052986
2052989,Use Webkit and Imagemagick to create cross-browser buttons and other swag,http://blogs.sitepoint.com/2010/12/31/use-webkit-and-imagemagick-to-create-cross-browser-buttons/,troels,2,0,2010-12-30 18:02:34+00:00,1293732154,,"story, author_troels, story_2052989",https://news.ycombinator.com/item?id=2052989
2052990,Reflecting a milestone year: 12 Tech-Lessons learned in 12 months,http://wisdomclouds.posterous.com/37803431,wisdomclouds,2,0,2010-12-30 18:02:42+00:00,1293732162,,"story, author_wisdomclouds, story_2052990",https://news.ycombinator.com/item?id=2052990
2053013,Solar Funnels that Convert Sunlight into Fuel,http://solarfeeds.com/cleanenergyauthoritycom/15499-solar-funnels-that-convert-sunlight-into-fuel-,tessant,2,0,2010-12-30 18:09:41+00:00,1293732581,,"story, author_tessant, story_2053013",https://news.ycombinator.com/item?id=2053013
2053016,"Ask HN: Is the ""SEO is Snake Oil"" Myth Dead?",,scottkrager,2,1,2010-12-30 18:10:13+00:00,1293732613,"I've noticed a considerable drop in the ""SEO is Snake Oil"" meme this last year.<p>Will the myth die totally in 2011?","story, author_scottkrager, story_2053016, ask_hn",https://news.ycombinator.com/item?id=2053016
2053027,China Declares Skype Illegal,"http://www.pcmag.com/article2/0,2817,2374898,00.asp",adeelarshad82,17,6,2010-12-30 18:13:14+00:00,1293732794,,"story, author_adeelarshad82, story_2053027",https://news.ycombinator.com/item?id=2053027
2053042,Getting the data with Mixpanel and iOS,http://codebeef.com/getting-the-data-with-mixpanel-and-ios/,suhail,6,0,2010-12-30 18:17:05+00:00,1293733025,,"story, author_suhail, story_2053042",https://news.ycombinator.com/item?id=2053042
2053076,How to Install Ruby 1.9.2 and Rails 3.0 on Ubuntu 10.10,http://www.rubyinside.com/how-to-install-ruby-1-9-2-and-rails-3-0-on-ubuntu-10-10-4148.html,spicerunner,4,0,2010-12-30 18:24:42+00:00,1293733482,"For those of us forced out of our warm, comfortable Mac OS X Rails development environments here's a nice screencast from Peter Cooper on installing Ruby, RVM and Rails on Ubuntu.  Hang in there Windows users...you're not forgotten...","story, author_spicerunner, story_2053076",https://news.ycombinator.com/item?id=2053076
2053109,2010's Interface Design Innovations,http://www.fastcodesign.com/1662959/12-of-the-years-best-ideas-in-interface-design-slideshow,driftsumi-e,4,0,2010-12-30 18:32:57+00:00,1293733977,,"story, author_driftsumi-e, story_2053109",https://news.ycombinator.com/item?id=2053109
2053111,27C3 Video collection,http://achtbaan.nikhef.nl/27c3-stream/releases/mkv/,r11t,3,0,2010-12-30 18:33:12+00:00,1293733992,,"story, author_r11t, story_2053111",https://news.ycombinator.com/item?id=2053111
2053152,Startup Prayer,http://www.enotes.com/shakespeare-quotes/there-tide-affairs-men,sayemm,3,0,2010-12-30 18:42:07+00:00,1293734527,,"story, author_sayemm, story_2053152",https://news.ycombinator.com/item?id=2053152
2053172,10 Best Infographics of 2010,http://nowsourcing.com/2010/12/28/best-infographics-of-2010/,nowsourcing,13,6,2010-12-30 18:48:17+00:00,1293734897,,"story, author_nowsourcing, story_2053172",https://news.ycombinator.com/item?id=2053172
2053180,Internet users spend about $10 per month on digital content,http://www.techflash.com/seattle/2010/12/internet-users-spend-about-10-per.html,cwan,1,0,2010-12-30 18:50:17+00:00,1293735017,,"story, author_cwan, story_2053180",https://news.ycombinator.com/item?id=2053180
2053190,How to Learn Math and Physics,http://math.ucr.edu/home/baez/books.html,olalonde,2,0,2010-12-30 18:52:07+00:00,1293735127,,"story, author_olalonde, story_2053190",https://news.ycombinator.com/item?id=2053190
2053197,How the neo-medieval 21st century will be more like the 12th century,http://www.paragkhanna.com/?p=956,cwan,75,39,2010-12-30 18:54:20+00:00,1293735260,,"story, author_cwan, story_2053197",https://news.ycombinator.com/item?id=2053197
2053207,Don't believe the rosy forecasts ,http://finance.fortune.cnn.com/2010/12/30/dont-believe-the-rosy-forecasts/,cwan,2,0,2010-12-30 18:56:19+00:00,1293735379,,"story, author_cwan, story_2053207",https://news.ycombinator.com/item?id=2053207
2053211,President of RISD on the importance of art for innovation ,http://seedmagazine.com/content/article/on_meaningful_observation1/,mgdiaz,2,0,2010-12-30 18:58:40+00:00,1293735520,,"story, author_mgdiaz, story_2053211",https://news.ycombinator.com/item?id=2053211
2053219,IMDb still run from a house in Bristol,http://www.dailymail.co.uk/sciencetech/article-1342663/IMDb-run-self-confessed-geek-Colin-Needham-house-Bristol.html,mtkd,2,0,2010-12-30 19:01:13+00:00,1293735673,,"story, author_mtkd, story_2053219",https://news.ycombinator.com/item?id=2053219
2053221,Ask HN: What Features Do You Take From Language To Language?,,joe_the_user,1,0,2010-12-30 19:02:06+00:00,1293735726,"Hey,<p>Back when I was using Ruby, I got used to objects that I could add members to freely.<p>Now that I'm back to using c++, I find I'm using a wrapper class around a QHash for my basic data type. It seems to work amazingly well since I suddenly don't have to worry about ""structure conversion hell"" and instead pass a basket of arbitrary characteristics around (and I can still add guards within the wrapper class for conversion, safety etc). Essentially, I'm using the Ruby language approach of duck-typing when I need to while having the speed and libraries of c++.<p>Anyone else find themselves ""transplanting"" features of languages they've used in the past into their current favorite in a way that worked well? (Obviously, there are many ways to do this badly too).","story, author_joe_the_user, story_2053221, ask_hn",https://news.ycombinator.com/item?id=2053221
2053222,First Earth-like planet discovered,"http://www.time.com/time/health/article/0,8599,2022489,00.html",pharrington,1,0,2010-12-30 19:02:24+00:00,1293735744,,"story, author_pharrington, story_2053222",https://news.ycombinator.com/item?id=2053222
2053226,A recap of threewords.me and the part vanity played,http://thegrinch.posterous.com/a-recap-of-threewordsme,instakill,2,0,2010-12-30 19:03:31+00:00,1293735811,,"story, author_instakill, story_2053226",https://news.ycombinator.com/item?id=2053226
2053228,Cambridge University refuses to censor student's thesis,http://www.boingboing.net/2010/12/25/cambridge-university-1.html,r11t,498,61,2010-12-30 19:04:11+00:00,1293735851,,"story, author_r11t, story_2053228",https://news.ycombinator.com/item?id=2053228
2053229,Implementation of Monads in JavaScript,https://github.com/keean/jsmonads,peterbe,2,1,2010-12-30 19:04:40+00:00,1293735880,,"story, author_peterbe, story_2053229",https://news.ycombinator.com/item?id=2053229
2053231,Bufferbloat: buffer sizing in networks,http://gettys.wordpress.com/2010/12/03/introducing-the-criminal-mastermind-bufferbloat/,xtacy,4,0,2010-12-30 19:05:02+00:00,1293735902,,"story, author_xtacy, story_2053231",https://news.ycombinator.com/item?id=2053231
2053239,Appjet Server In A Jar - Now On GitHub,http://blog.jgate.de/appjet-server-in-a-jar-now-on-github,js4all,1,0,2010-12-30 19:06:26+00:00,1293735986,,"story, author_js4all, story_2053239",https://news.ycombinator.com/item?id=2053239
2053244,Ask HN: selling a web site,,dholowiski,8,4,2010-12-30 19:07:05+00:00,1293736025,"Can the HN crowd give some advice on selling a web site - where to sell it, how to prepare etc. I have a site with no traffic but a great idea, I just have no time to market it.<p>I tried searching HN but the most recent ask's I could find were 3 years old.","story, author_dholowiski, story_2053244, ask_hn",https://news.ycombinator.com/item?id=2053244
2053274,Tool of the Day: Illuminate your Business with Skylight,http://www.usefultools.com/2010/12/illuminate-your-business/,greengirl512,1,0,2010-12-30 19:15:46+00:00,1293736546,,"story, author_greengirl512, story_2053274",https://news.ycombinator.com/item?id=2053274
2053275,Tool of the Day: Illuminate your Business with Skylight,http://www.usefultools.com/2010/12/illuminate-your-business/,greengirl512,1,0,2010-12-30 19:15:46+00:00,1293736546,,"story, author_greengirl512, story_2053275",https://news.ycombinator.com/item?id=2053275
2053280,Using LINQPad to Query Stack Overflow,http://coderjournal.com/2010/06/using-linqpad-to-query-stack-overflow/,nberardi,4,0,2010-12-30 19:17:00+00:00,1293736620,,"story, author_nberardi, story_2053280",https://news.ycombinator.com/item?id=2053280
2053281,How High Speed Rail Will Create the Next Walmart,http://www.duncankinney.com/high-speed-rail-as-fundamental-economic-infra,DuncanK,3,0,2010-12-30 19:17:08+00:00,1293736628,,"story, author_DuncanK, story_2053281",https://news.ycombinator.com/item?id=2053281
2053287,Share HN: My new business book comes out today,,joshkaufman,15,3,2010-12-30 19:19:15+00:00,1293736755,"I wrote a book, ""The Personal MBA: Master the Art of Business,"" and it comes out today. The subtitle could very well have been ""business for hackers.""<p>Here's my launch blog post:
http://personalmba.com/personal-mba-book-launch/<p>Here's the book website:
http://book.personalmba.com<p>This book started as a personal side project. My goal was to isolate the most important business-related mental models, so I could use them to do more valuable work. By sharing what I learned in the process, I hope to dramatically decrease the time it takes you to master the essentials of business, so you can spend more time doing work that matters.<p>I also hope the book saves you a ton of money. Business school is insanely expensive, and requires you to give up your freedom and flexibility for decades. By learning the essentials for ~$20, you'll be able to skip the classroom in favor of starting your startup.<p>Hacker News has been a wonderfully supportive community for me over the years, and I'm grateful to everyone who contributes. I hope this book helps you make great things happen.<p>If you have any questions about the book, business education, or about trade publishing in general, I'd be happy to help.","story, author_joshkaufman, story_2053287, ask_hn",https://news.ycombinator.com/item?id=2053287
2053291,Game Mechanics,http://gamification.org/wiki/Game_Mechanics,yarapavan,2,0,2010-12-30 19:19:56+00:00,1293736796,,"story, author_yarapavan, story_2053291",https://news.ycombinator.com/item?id=2053291
2053297,UPS’s 2011 4.9% increase could be around 17%,http://wlangford.com/2010/12/30/upss-2011-4-9-increase-could-be-around-17/,willlangford,2,0,2010-12-30 19:20:33+00:00,1293736833,,"story, author_willlangford, story_2053297",https://news.ycombinator.com/item?id=2053297
2053307,New Law Makes it More Difficult to Fire Teleworkers?,http://www.newsweek.com/blogs/kausfiles/2010/12/30/don-t-fire-i-m-a-teleworker.html,cwan,3,0,2010-12-30 19:23:30+00:00,1293737010,,"story, author_cwan, story_2053307",https://news.ycombinator.com/item?id=2053307
2053310,Ask HN: What qualities make a marketer good/great?,,mathgladiator,5,1,2010-12-30 19:24:10+00:00,1293737050,"My 2011 goal is to launch 12 products (or six), and I'm looking to get some marketing support. What should I be looking for in people?","story, author_mathgladiator, story_2053310, ask_hn",https://news.ycombinator.com/item?id=2053310
2053312,New Data Stealing Trojan For Android Has Botnet Capabilities ,http://threatpost.com/en_us/blogs/new-data-stealing-trojan-android-has-botnet-capabilities-123010,wglb,2,0,2010-12-30 19:24:27+00:00,1293737067,,"story, author_wglb, story_2053312",https://news.ycombinator.com/item?id=2053312
2053316,How to Maintain Your Personal Brand as a Corporate Employee - Smashing Magazine,http://www.smashingmagazine.com/2010/12/28/how-to-maintain-your-personal-brand-as-a-corporate-employee/,obilgic,8,0,2010-12-30 19:25:32+00:00,1293737132,,"story, author_obilgic, story_2053316",https://news.ycombinator.com/item?id=2053316
2053323,Why Lisp in US and Prolog in Europe (for AI),http://www.cse.yorku.ca/course_archive/1998-99/F/3401/lectures/340198-9-14HTML/sld002.htm,clyfe,3,0,2010-12-30 19:27:14+00:00,1293737234,,"story, author_clyfe, story_2053323",https://news.ycombinator.com/item?id=2053323
2053329,Elite Quants: Hedge Fund Vs. Start-Up?,http://www.istockanalyst.com/article/viewarticle/articleid/4774905,yarapavan,2,0,2010-12-30 19:29:18+00:00,1293737358,,"story, author_yarapavan, story_2053329",https://news.ycombinator.com/item?id=2053329
2053339,"'If You Don't Use Creative Accounting in Reporting to U.S. News, You're a Chump'",http://taxprof.typepad.com/taxprof_blog/2010/12/aba-seeks.html,cwan,2,0,2010-12-30 19:33:01+00:00,1293737581,,"story, author_cwan, story_2053339",https://news.ycombinator.com/item?id=2053339
2053364,Interesti.ng Nigerian domains go on sale,http://thenextweb.com/industry/2010/12/30/interesti-ng-nigerian-domains-go-on-sale-so-get-registeri-ng/?awesm=tnw.to_17GDn&utm_content=twitter-publisher-main&utm_medium=tnw.to-twitter&utm_source=direct-tnw.to,zeedotme,1,0,2010-12-30 19:41:03+00:00,1293738063,,"story, author_zeedotme, story_2053364",https://news.ycombinator.com/item?id=2053364
2053365,10 nifty touch screen apps for Windows 7 tablets,http://voato.com/tech/windows/touchscreen-apps-for-windows-7-tablets/,petewood,1,0,2010-12-30 19:41:19+00:00,1293738079,,"story, author_petewood, story_2053365",https://news.ycombinator.com/item?id=2053365
2053369,Free Kindle Math Books,http://math-blog.com/2010/12/30/free-kindle-math-books/,acangiano,44,15,2010-12-30 19:42:10+00:00,1293738130,,"story, author_acangiano, story_2053369",https://news.ycombinator.com/item?id=2053369
2053386,JRuby rack server that supports zero downtime deploys (based on Jetty),https://github.com/carllerche/kirk,bretpiatt,2,0,2010-12-30 19:51:18+00:00,1293738678,,"story, author_bretpiatt, story_2053386",https://news.ycombinator.com/item?id=2053386
2053387,India's $35 tablet,http://www.youtube.com/watch?v=Ok4z9Xpapzc,yayitswei,2,1,2010-12-30 19:51:33+00:00,1293738693,,"story, author_yayitswei, story_2053387",https://news.ycombinator.com/item?id=2053387
2053389,"Ask HN: Review Tout - templates, scheduling and analytics for your emails",,Tawheed,3,1,2010-12-30 19:52:26+00:00,1293738746,"My weekend project is growing up to be a real product. I'd love some feedback...Can you please check it out?<p>I originally blogged about it here:
http://bit.ly/i84mIk<p>The URL for my product:
http://toutapp.com","story, author_Tawheed, story_2053389, ask_hn",https://news.ycombinator.com/item?id=2053389
2053394,Fiber-Optic Networks Regain Some Glow,http://online.wsj.com/article/SB10001424052970204467204576048110913769584.html,joelhaus,1,0,2010-12-30 19:53:19+00:00,1293738799,,"story, author_joelhaus, story_2053394",https://news.ycombinator.com/item?id=2053394
2053399,Chaos Communication Congress talks now downloadable,http://www.derchris.eu/CCC/27C3/,Luc,1,1,2010-12-30 19:54:24+00:00,1293738864,,"story, author_Luc, story_2053399",https://news.ycombinator.com/item?id=2053399
2053400,Skype Offers Credit for Recent Outage,http://consumerist.com/2010/12/skype-offers-credit-voucher-following-massive-outage.html,pyre,2,0,2010-12-30 19:55:38+00:00,1293738938,,"story, author_pyre, story_2053400",https://news.ycombinator.com/item?id=2053400
2053402,Ask HN: Textmate Alternatives?,,barredo,7,20,2010-12-30 19:57:51+00:00,1293739071,"I really like TM, but 2011 seems a nice year to try new alternatives.","story, author_barredo, story_2053402, ask_hn",https://news.ycombinator.com/item?id=2053402
2053405,Snowflakes - No Two Alike?,http://www.its.caltech.edu/~atomic/snowcrystals/alike/alike.htm,shawndumas,1,0,2010-12-30 19:58:28+00:00,1293739108,,"story, author_shawndumas, story_2053405",https://news.ycombinator.com/item?id=2053405
2053410,JRuby Finally Installs ruby-debug Gem,http://blog.headius.com/2010/12/jruby-finally-installs-ruby-debug-gem.html,shimonamit,1,0,2010-12-30 20:00:26+00:00,1293739226,,"story, author_shimonamit, story_2053410",https://news.ycombinator.com/item?id=2053410
2053415,Lending of Kindle Books,http://forums.digitaltextplatform.com/dtpforums/entry.jspa?externalID=581,jasongullickson,1,0,2010-12-30 20:02:10+00:00,1293739330,,"story, author_jasongullickson, story_2053415",https://news.ycombinator.com/item?id=2053415
2053417,Five most underreported stories of 2010,http://edition.cnn.com/2010/TECH/web/12/30/overlooked.tech.stories/,10smom,1,0,2010-12-30 20:02:36+00:00,1293739356,,"story, author_10smom, story_2053417",https://news.ycombinator.com/item?id=2053417
2053420,10 Transportation Trends That Rocked 2010 | Autopia | Wired.com,http://www.wired.com/autopia/2010/12/10-transportation-trends-that-rocked-2010/?pid=427&pageid=30818&viewall=true,10smom,1,0,2010-12-30 20:03:29+00:00,1293739409,,"story, author_10smom, story_2053420",https://news.ycombinator.com/item?id=2053420
2053421,The Pogies: Best Tech Ideas of the Year,http://www.nytimes.com/2010/12/30/technology/personaltech/30pogue.html?_r=2&nl=technology&emc=techupdateemb1,JarekS2,2,0,2010-12-30 20:04:06+00:00,1293739446,,"story, author_JarekS2, story_2053421",https://news.ycombinator.com/item?id=2053421
2053430,TechStars Boston Applications Are Heating Up,http://www.feld.com/wp/archives/2010/12/techstars-boston-applications-are-heating-up.html,shimonamit,3,0,2010-12-30 20:06:07+00:00,1293739567,,"story, author_shimonamit, story_2053430",https://news.ycombinator.com/item?id=2053430
2053433,Seed Hatchery in Memphis now taking applications for up to $15K,http://www.seedhatchery.com/,rbranson,2,0,2010-12-30 20:06:50+00:00,1293739610,,"story, author_rbranson, story_2053433",https://news.ycombinator.com/item?id=2053433
2053436,Governments embrace angel funding,http://www.vancouversun.com/business/Governments+embrace+angel+funding/4040115/story.html,10smom,2,1,2010-12-30 20:07:08+00:00,1293739628,,"story, author_10smom, story_2053436",https://news.ycombinator.com/item?id=2053436
2053437,Hire me (an ex .NET developer) as your Ruby intern for a year,http://www.osherove.com/blog/2010/12/30/hire-me-as-your-ruby-intern-for-a-year.html#,rayvega,2,1,2010-12-30 20:07:17+00:00,1293739637,,"story, author_rayvega, story_2053437",https://news.ycombinator.com/item?id=2053437
2053444,Android Honeycomb Music Player: Full Guide [Early Leak],http://androidcommunity.com/android-honeycomb-music-player-full-guide-early-leak-20101230/,sandipc,2,0,2010-12-30 20:09:49+00:00,1293739789,,"story, author_sandipc, story_2053444",https://news.ycombinator.com/item?id=2053444
2053446,"Scapy, and Random Acts of Packety Violence",http://www.packetstan.com/2010/12/scapy-and-random-acts-of-packety.html,r11t,5,0,2010-12-30 20:10:21+00:00,1293739821,,"story, author_r11t, story_2053446",https://news.ycombinator.com/item?id=2053446
2053448,Doctors Getting Rich With Fusion Surgery Debunked by Studies,http://www.bloomberg.com/news/2010-12-30/highest-paid-u-s-doctors-get-rich-with-fusion-surgery-debunked-by-studies.html,joelhaus,1,0,2010-12-30 20:10:59+00:00,1293739859,,"story, author_joelhaus, story_2053448",https://news.ycombinator.com/item?id=2053448
2053463,Skype: We Have Not Been Banned in China,http://mashable.com/2010/12/30/china-skype-ban/?utm_source=feedburner&utm_medium=feed&utm_campaign=Feed%3A+Mashable+%28Mashable%29&utm_content=Google+Feedfetcher,azazo,44,3,2010-12-30 20:13:22+00:00,1293740002,,"story, author_azazo, story_2053463",https://news.ycombinator.com/item?id=2053463
2053471,Bad Copy Kills – Read It Out Loud,http://www.cindyalvarez.com/communication/bad-copy-kills-read-it-out-loud,johns,6,0,2010-12-30 20:14:52+00:00,1293740092,,"story, author_johns, story_2053471",https://news.ycombinator.com/item?id=2053471
2053473,Top Stories in Education in 2010,http://blog.learnboost.com/blog/top-10-stories-in-education-in-2010/,meremagee,4,0,2010-12-30 20:15:15+00:00,1293740115,,"story, author_meremagee, story_2053473",https://news.ycombinator.com/item?id=2053473
2053476,Apple investigating Ping-like social networking for retail shops,http://www.appleinsider.com/articles/10/12/30/apple_investigating_ping_like_social_networking_for_retail_shops.html,10smom,1,0,2010-12-30 20:16:31+00:00,1293740191,,"story, author_10smom, story_2053476",https://news.ycombinator.com/item?id=2053476
2053478,Verizon iPhone reportedly coming 'after CES' | iPhone Atlas - CNET Reviews,http://reviews.cnet.com/8301-19512_7-20026822-233.html,10smom,2,0,2010-12-30 20:18:27+00:00,1293740307,,"story, author_10smom, story_2053478",https://news.ycombinator.com/item?id=2053478
2053484,Why do good programmers have ugly websites?,http://programmers.stackexchange.com/questions/32674/why-do-good-programmers-have-ugly-websites,jgv,1,0,2010-12-30 20:21:38+00:00,1293740498,,"story, author_jgv, story_2053484",https://news.ycombinator.com/item?id=2053484
2053485,FBI raids Texas colocation facility in 4chan DDoS probe,http://arstechnica.com/security/news/2010/12/fbi-raids-texas-colocation-facility-in-anonymous-ddos-probe.ars,phsr,5,0,2010-12-30 20:21:41+00:00,1293740501,,"story, author_phsr, story_2053485",https://news.ycombinator.com/item?id=2053485
2053487,Secrets To Success - Eric Thomas Edition,http://blog.sokanu.com/secrets-to-success-eric-thomas-edition,sthomps,3,0,2010-12-30 20:22:16+00:00,1293740536,,"story, author_sthomps, story_2053487",https://news.ycombinator.com/item?id=2053487
