ticker,date,title,url,domain,language,tone,source
AAPL,2025-08-26,蘋果傳推入門款MacBook搭A18 Pro晶片 「 親民價 」 讓果粉難下手 | 3C家電,https://tech.udn.com/tech/story/123152/8963548,tech.udn.com,Chinese,0.0,gdelt_gkg
AAPL,2025-08-26,"Trump Says Discrimination Against American Tech Giants  Must End  Now : Warns China And EU ,  Show Respect … Or Consider The Consequence - Alphabet ( NASDAQ : GOOG ), Apple ( NASDAQ : AAPL ) ",https://www.benzinga.com/markets/tech/25/08/47323047/trump-says-discrimination-against-american-tech-giants-must-end-now-warns-china-and-eu-show-respecto,benzinga.com,English,0.0,gdelt_gkg
AAPL,2025-08-26,馬斯克氣炸提告 ！ 怒控蘋果偏袒OpenAI聯手排擠同業 傷害AI競爭 | AI浪潮,https://tech.udn.com/tech/story/123454/8962807,tech.udn.com,Chinese,0.0,gdelt_gkg
AAPL,2025-08-26,華爾街日報 》 揭秘英特爾與川普微妙博弈的幕後 ： 川普先開砲後簽約 ， 白宮成最大股東 | 新聞,https://www.storm.mg/article/11062849,storm.mg,Chinese,0.0,gdelt_gkg
AAPL,2025-08-26,蘋果華裔工程師偷竊商業機密 跳槽去了OPPO | 蘋果華裔工程師竊密 | 陳石 | oppo,https://www.ntdtv.com/b5/2025/08/25/a104014384.html,ntdtv.com,Chinese,0.0,gdelt_gkg
AAPL,2025-08-26,Perplexity to let publishers share in revenue from AI searches,https://www.mercurynews.com/2025/08/25/perplexity-to-let-publishers-share-in-revenue-from-ai-searches/,mercurynews.com,English,0.0,gdelt_gkg
AAPL,2025-08-26,"Elon Musk xAI Sues Apple , OpenAI Over Antitrust in AI Deal",https://www.webpronews.com/elon-musks-xai-sues-apple-openai-over-antitrust-in-ai-deal/,webpronews.com,English,0.0,gdelt_gkg
AAPL,2025-08-26,xAI Sues Apple and OpenAI Over Antitrust AI Conspiracy,https://www.webpronews.com/xai-sues-apple-and-openai-over-antitrust-ai-conspiracy/,webpronews.com,English,0.0,gdelt_gkg
AAPL,2025-08-26,蘋果9月發表會爆 「 產品全出列超華麗 」！ Mac系列變遺珠不尋常 | 3C家電,https://tech.udn.com/tech/story/123152/8963796,tech.udn.com,Chinese,0.0,gdelt_gkg
AAPL,2025-08-26,"Trump Says Discrimination Against American Tech Giants  Must End  Now : Warns China And EU ,  Show Respect … Or Consider The Consequence - Alphabet ( NASDAQ : GOOG ), Apple ( NASDAQ : AAPL ) ",https://www.benzinga.com/markets/tech/25/08/47323047/trump-says-discrimination-against-american-tech-giants-must-end-now-warns-china-and-eu-show-respector-consider-the-consequences,benzinga.com,English,0.0,gdelt_gkg
AAPL,2025-08-26,"X Sues Apple , OpenAI For Cutting  Anticompetitive  Deal",https://www.law360.com:443/articles/2380656,law360.com,English,0.0,gdelt_gkg
AAPL,2025-08-26,Elon Musk sues Apple over ChatGPT monopoly and App Store bias,https://www.fonearena.com/blog/462595/elon-musk-sues-apple-chatgpt-monopoly-app-store-bias.html,fonearena.com,English,0.0,gdelt_gkg
AAPL,2025-08-26,"Musk sues Apple , OpenAI , saying they hurt AI competition",https://www.spokesman.com/stories/2025/aug/25/musk-sues-apple-openai-saying-they-hurt-ai-competi/,spokesman.com,English,0.0,gdelt_gkg
AAPL,2025-08-26,US stocks waffle as Trump attack on Fed Cook unnerves traders,https://www.spokesman.com/stories/2025/aug/26/us-stocks-waffle-as-trump-attack-on-feds-cook-unne/,spokesman.com,English,0.0,gdelt_gkg
AAPL,2025-08-26,Apple news : Big iPhone launch coming on September 9,https://www.bnnbloomberg.ca/business/company-news/2025/08/26/apples-big-iphone-launch-is-coming-on-september-9-what-to-expect/,bnnbloomberg.ca,English,0.0,gdelt_gkg
AAPL,2025-08-26,الوان غير مسبوقة .. أبل تكشف أسرار iPhone 17,https://www.alsumaria.tv/news/technology/538513/%D8%A7%D9%84%D9%88%D8%A7%D9%86-%D8%BA%D9%8A%D8%B1-%D9%85%D8%B3%D8%A8%D9%88%D9%82%D8%A9-%D8%A3%D8%A8%D9%84-%D8%AA%D9%83%D8%B4%D9%81-%D8%A3%D8%B3%D8%B1%D8%A7%D8%B1-iphone-17,alsumaria.tv,Arabic,0.0,gdelt_gkg
AAPL,2025-08-26,Apple September 9 Event Unveils iPhone 17 with AI Upgrades and Slim Design,https://www.webpronews.com/apples-september-9-event-unveils-iphone-17-with-ai-upgrades-and-slim-design/,webpronews.com,English,0.0,gdelt_gkg
AAPL,2025-08-26,9月9日蘋果新品發布會登場 iPhone17將亮相 | iPhone 17,https://www.epochtimes.com/b5/25/8/26/n14581768.htm,epochtimes.com,Chinese,0.0,gdelt_gkg
AAPL,2025-08-26,Apple August stock revival gives hope to concerned investors – Silicon Valley,https://www.siliconvalley.com/2025/08/26/apples-august-stock-revival-gives-hope-to-concerned-investors/,siliconvalley.com,English,0.0,gdelt_gkg
AAPL,2025-08-26,Who the Next Apple ? 3 Breakout Stocks That Point the Way,https://investorplace.com/smartmoney/2025/08/the-next-apple-3-breakout-stocks-that-point-the-way/,investorplace.com,English,0.0,gdelt_gkg
AAPL,2025-08-26,Apple August stock revival gives hope to concerned investors,https://biztoc.com/x/84ff94ff06d98ea2,biztoc.com,English,0.0,gdelt_gkg
AAPL,2025-08-26,Musk xAI sues Apple and OpenAI for alleged AI conspiracy lawsuit,https://www.foxbusiness.com/technology/elon-musks-xai-sues-apple-openai-over-ai-competition-app-store-rankings,foxbusiness.com,English,0.0,gdelt_gkg
AAPL,2025-08-26,كم يبلغ سعر نظارات سامسونغ للواقع الممتد ؟ ,https://www.khaberni.com/news/728950-%D9%83%D9%85-%D9%8A%D8%A8%D9%84%D8%BA-%D8%B3%D8%B9%D8%B1-%D9%86%D8%B8%D8%A7%D8%B1%D8%A7%D8%AA-%D8%B3%D8%A7%D9%85%D8%B3%D9%88%D9%86%D8%BA-%D9%84%D9%84%D9%88%D8%A7%D9%82%D8%B9-%D8%A7%D9%84%D9%85%D9%85%D8%AA%D8%AF%D8%9F,khaberni.com,Arabic,0.0,gdelt_gkg
AAPL,2025-08-26,🍎 * ตามคาด !  แอปเปิ้ล  ร่อนการ์ดแจ้งเปิดตัว iPhone 17 วันที่ 9,https://www.ryt9.com/s/iq36/12742190,ryt9.com,Thai,0.0,gdelt_gkg
AAPL,2025-08-26,டிரம்ப் வரி : பிற பொருள்களுக்கு அச்சுறுத்தலாக இருந்தாலும் இதன் விலை மட்டும் மாறாதது ஏன் ? ,https://www.dinamani.com/india/2025/Aug/26/trump-tariffs-why-doesnt-change-price-one-product,dinamani.com,Tamil,0.0,gdelt_gkg
AAPL,2025-08-26,"Apple claims former employee , China smartphone maker stole trade secrets",https://www.ocregister.com/2025/08/26/apple-claims-ex-employee-chinas-oppo-stole-trade-secrets/,ocregister.com,English,0.0,gdelt_gkg
AAPL,2025-08-26,หุ้น  แอปเปิ้ล  ดีดบวก ขานรับเปิดตัว iPhone 17 วันที่ 9,https://www.ryt9.com/s/iq20/12742191,ryt9.com,Thai,0.0,gdelt_gkg
AAPL,2025-08-26,"Musk Sues Apple , OpenAI , Saying They Hurt AI Competition",https://www.insurancejournal.com/news/national/2025/08/26/836927.htm,insurancejournal.com,English,0.0,gdelt_gkg
AAPL,2025-08-26,  آبل تقدم حلاً سحرياً لمستخدميها لإيقاف الاتصالات المزعجة,https://www.albayan.ae/technology/tech-radar/407570,albayan.ae,Arabic,0.0,gdelt_gkg
AAPL,2025-08-26,Apple August Stock Revival Gives Hope to Concerned Investors,https://finance.yahoo.com/news/apple-august-stock-revival-gives-110100142.html,finance.yahoo.com,English,0.0,gdelt_gkg
AAPL,2025-08-26,🍎 * จับตา  แอปเปิ้ล  ร่อนการ์ดคืนนี้ 4 ทุ่มแจ้งเปิดตัว iPhone 17 วันที่ 9,https://www.ryt9.com/s/iq36/12742177,ryt9.com,Thai,0.0,gdelt_gkg
AAPL,2025-08-26,首富的攪屎棍 ！ 蘋果綁ChatGPT惹怒馬斯克 一次性怒告2巨頭蘋果 、 OpenAI | 科技,https://www.setn.com/News.aspx?NewsID=1710107,setn.com,Chinese,0.0,gdelt_gkg
AAPL,2025-08-26,Apple defies Trump with India production plans,http://www.laosnews.net/news/278534050/apple-defies-trump-with-india-production-plans-media,laosnews.net,English,0.0,gdelt_gkg
AAPL,2025-08-26,Apple defies Trump with India production plans media,http://www.laosnews.net/news/278534044/apple-defies-trump-with-india-production-plans-media,laosnews.net,English,0.0,gdelt_gkg
AAPL,2025-08-26,Apple defies Trump with India production plans media,http://www.calcuttanews.net/news/278534044/apple-defies-trump-with-india-production-plans-media,calcuttanews.net,English,0.0,gdelt_gkg
AAPL,2025-08-26,Consumer Spending Under Scrutiny : Inflationary Pressures and Their Impact on Market Dynamics,https://markets.financialcontent.com/stocks/article/marketminute-2025-8-26-consumer-spending-under-scrutiny-inflationary-pressures-and-their-impact-on-market-dynamics,markets.financialcontent.com,English,0.0,gdelt_gkg
AAPL,2025-08-27,Top Technology Stocks To Watch Today – August 26th,https://www.tickerreport.com/banking-finance/13123679/top-technology-stocks-to-watch-today-august-26th.html,tickerreport.com,English,0.0,gdelt_gkg
AAPL,2025-08-27,Apple stock up after rough year | The Arkansas Democrat - Gazette - Arkansa Best News Source,https://www.arkansasonline.com/news/2025/aug/27/apples-stock-up-after-rough-year/,arkansasonline.com,English,0.0,gdelt_gkg
AAPL,2025-08-27,تنبؤات حول هاتف ايفون 17 الجديد قبل نحو شهر من كشفه في سبتمبر,https://arabic.cnn.com/world/article/2025/08/27/apples-big-iphone-launch-is-coming-on-september-9-what-to-expect,arabic.cnn.com,Arabic,0.0,gdelt_gkg
AAPL,2025-08-27,India Isnt Worst Hit : List Of Top - 10 Countries With Highest US Tariffs,https://www.hindustantimes.com/business/india-isnt-the-only-country-facing-highest-us-tariffs-heres-the-top-10-list-101756280456879.html,hindustantimes.com,English,0.0,gdelt_gkg
AAPL,2025-08-27,Large Cap Stocks To Keep An Eye On – August 25th,https://www.etfdailynews.com/2025/08/27/large-cap-stocks-to-keep-an-eye-on-august-25th/,etfdailynews.com,English,0.0,gdelt_gkg
AAPL,2025-08-27,Apple  Awe Dropping  Event Hints at iPhone 17 AI Upgrades and New Devices,https://www.webpronews.com/apples-awe-dropping-event-hints-at-iphone-17-ai-upgrades-and-new-devices/,webpronews.com,English,0.0,gdelt_gkg
AAPL,2025-08-27,Court Grants Motion to Preclude Attorney Fees Even Though Carrier Will  Not Entertain  Settlement | Zelle LLP,https://www.jdsupra.com/legalnews/court-grants-motion-to-preclude-9700750/,jdsupra.com,English,0.0,gdelt_gkg
AAPL,2025-08-27,US firms racing through $1 trillion buyback spree in record time,https://www.investmentnews.com/equities/us-firms-racing-through-1-trillion-buyback-spree-in-record-time/261871,investmentnews.com,English,0.0,gdelt_gkg
AAPL,2025-08-27,Washington Just Bought a Piece of an American Icon – Here What Coming Next ... ,https://investorplace.com/market360/2025/08/washington-just-bought-a-piece-of-an-american-icon-heres-whats-coming-next/,investorplace.com,English,0.0,gdelt_gkg
AAPL,2025-08-27,U . S . Companies Hit $1 Trillion Buyback Record,https://athens-times.com/u-s-companies-set-record-with-1-trillion-in-stock-buybacks/,athens-times.com,English,0.0,gdelt_gkg
AAPL,2025-08-27,جريدة النهار الكويتية | « أبل » تكشف عن هاتف « آيفون 17 » في 9 سبتمبر,https://www.annaharkw.com/annahar/Article.aspx?id=1027378,annaharkw.com,Arabic,0.0,gdelt_gkg
AAPL,2025-08-27,Apple Computer logo evolves with the times | Today in Apple history,https://www.cultofmac.com/apple-history/apple-computer-logo,cultofmac.com,English,0.0,gdelt_gkg
AAPL,2025-08-27,Apple Expands Music Push Through Radio Partnership with TuneIn,https://techstory.in/apple-expands-music-push-through-radio-partnership-with-tunein/,techstory.in,English,0.0,gdelt_gkg
AAPL,2025-08-27,"Apple India Production : भारत पर दांव बढ़ा रही ऐपल , उत्पादन - निर्यात बढ़ाया , पहली छमाही में 78 % निर्यात अमेरिका को - apple production extended to india extending bets on india 78 exports to america",https://hindi.business-standard.com/companies/apple-production-extended-to-india-extending-bets-on-india-78-exports-to-america-id-467714,hindi.business-standard.com,Hindi,0.0,gdelt_gkg
AAPL,2025-08-27,أبل تستعد لإطلاق AirPods Pro 3 مع ميزة صحية لمراقبة معدل ضربات القلب,https://www.raialyoum.com/%D8%A3%D8%A8%D9%84-%D8%AA%D8%B3%D8%AA%D8%B9%D8%AF-%D9%84%D8%A5%D8%B7%D9%84%D8%A7%D9%82-airpods-pro-3-%D9%85%D8%B9-%D9%85%D9%8A%D8%B2%D8%A9-%D8%B5%D8%AD%D9%8A%D8%A9-%D9%84%D9%85%D8%B1%D8%A7%D9%82%D8%A8/,raialyoum.com,Arabic,0.0,gdelt_gkg
AAPL,2025-08-27,سر خفي في آيفون .. كيف تعرف من يتجسس على رسائلك ؟ ,https://www.albayan.ae/technology/science-technology/software-saas/411358,albayan.ae,Arabic,0.0,gdelt_gkg
AAPL,2025-08-27,"Parallels Launches Parallels Desktop 26 with Support for macOS Tahoe 26 , Compatibility with Windows 11 25H2 , and New IT Management Tools",https://portal.sina.com.hk/finance/finance-globenewswire/globenewswire/2025/08/27/1279666/parallels-launches-parallels-desktop-26-with-support-for-macos-tahoe-26-compatibility-with-windows-11-25h2-and-new-it-management-tools/,portal.sina.com.hk,English,0.0,gdelt_gkg
AAPL,2025-08-27,美4大指數收高 投顧 ： 台股高檔震盪關注輝達財報 | 證券,https://www.cna.com.tw/news/afe/202508270017.aspx,cna.com.tw,Chinese,0.0,gdelt_gkg
AAPL,2025-08-27,تحت شعار غامض .. شركة أبل تعلن عن موعد مؤتمرها السنوي و هذا ما يتوقع أن يحدث خلاله – عكس السير,https://www.aksalser.com/news/2025/08/27/%D8%AA%D8%AD%D8%AA-%D8%B4%D8%B9%D8%A7%D8%B1-%D8%BA%D8%A7%D9%85%D8%B6-%D8%B4%D8%B1%D9%83%D8%A9-%D8%A3%D8%A8%D9%84-%D8%AA%D8%B9%D9%84%D9%86-%D8%B9%D9%86-%D9%85%D9%88%D8%B9%D8%AF-%D9%85%D8%A4%D8%AA/,aksalser.com,Arabic,0.0,gdelt_gkg
AAPL,2025-08-27,獨家 》 卓內閣新人事拍板加一 林宜敬升任數發部部長,https://ec.ltn.com.tw/article/breakingnews/5157695,ec.ltn.com.tw,Chinese,0.0,gdelt_gkg
AAPL,2025-08-27,World Today : ประเด็นข่าวต่างประเทศน่าติดตามวันนี้,https://www.ryt9.com/s/iq29/12742206,ryt9.com,Thai,0.0,gdelt_gkg
AAPL,2025-08-27,"Trump  Discriminatory  Tech Regulation Claims Attract EU Pushback , Brussels Cites Action Against Tiktok , Temu To Make Its Point - Alphabet ( NASDAQ : GOOG ), Apple ( NASDAQ : AAPL ) ",https://www.benzinga.com/markets/tech/25/08/47351162/trumps-discriminatory-tech-regulation-claims-attract-eu-pushback-brussels-cites-action-against-tikto,benzinga.com,English,0.0,gdelt_gkg
AAPL,2025-08-27,مقارنة بين ساعة  Pixel 4  من غوغل و  Watch Series 10  من أبل .. أيهما تتفوق ؟ ,https://www.eremnews.com/sciences-technology/4jxcdq0,eremnews.com,Arabic,0.0,gdelt_gkg
AAPL,2025-08-27,"Meta $800 Hypernova Glasses Will Be An  Experimental Product  And This One Thing Will Be  Most Important Selling Point , Says Analyst - Apple ( NASDAQ : AAPL ), Essilorluxottica ( OTC : ESLOY ) ",https://www.benzinga.com/markets/tech/25/08/47350012/metas-800-hypernova-glasses-will-be-an-experimental-product-and-this-one-thing-will-be-most-importan,benzinga.com,English,0.0,gdelt_gkg
AAPL,2025-08-27,Clock is ticking ! India braces for 50 % tariff hit as Donald Trump trade levies loom : 10 points,https://www.livemint.com/news/world/clock-is-ticking-india-braces-for-50-tariff-hit-as-donald-trump-trade-levies-loom-stock-market-brics-trade-russian-oil-11756253730854.html,livemint.com,English,0.0,gdelt_gkg
AAPL,2025-08-27,歐盟重申有權制定數字政策 駁斥美方指責 | 國際,https://www.hkcna.hk/docDetail.jsp?id=101092461&channel=2810,hkcna.hk,Chinese,0.0,gdelt_gkg
AAPL,2025-08-27,Parallels Launches Parallels Desktop 26 with Support for,https://www.globenewswire.com/news-release/2025/08/27/3139740/0/en/Parallels-Launches-Parallels-Desktop-26-with-Support-for-macOS-Tahoe-26-Compatibility-with-Windows-11-25H2-and-New-IT-Management-Tools.html,globenewswire.com,English,0.0,gdelt_gkg
AAPL,2025-08-27,華為蘋果預告發布新品 中國手機市場競爭升溫 | 內地,https://www.hkcna.hk/docDetail.jsp?id=101092440&channel=2808,hkcna.hk,Chinese,0.0,gdelt_gkg
AAPL,2025-08-27,Stock market braces for Nvidia earnings as S & P 500 struggles to extend Jackson Hole rally,https://finance.yahoo.com/news/stock-market-braces-nvidia-earnings-204000417.html,finance.yahoo.com,English,0.0,gdelt_gkg
AAPL,2025-08-27,"Trump  Discriminatory  Tech Regulation Claims Attract EU Pushback , Brussels Cites Action Against Tiktok , Temu To Make Its Point - Alphabet ( NASDAQ : GOOG ), Apple ( NASDAQ : AAPL ) ",https://www.benzinga.com/markets/tech/25/08/47351162/trumps-discriminatory-tech-regulation-claims-attract-eu-pushback-brussels-cites-action-against-tiktok-temu-to-make-its-point,benzinga.com,English,0.0,gdelt_gkg
AAPL,2025-08-27,Caught : TIME Magazine warps Steve Jobs photo to make him appear thinner,https://macdailynews.com/2008/12/17/caught_time_magazine_warps_steve_jobs_photo_to_make_him_appear_thinner/comment-page-3/,macdailynews.com,English,0.0,gdelt_gkg
AAPL,2025-08-27,"Trump 50 % tariffs on India take effect , among the highest in the world",https://www.thestar.com.my/aseanplus/aseanplus-news/2025/08/27/trump039s-50-tariffs-on-india-take-effect-among-the-highest-in-the-world,thestar.com.my,English,0.0,gdelt_gkg
AAPL,2025-08-28,"US close : Wall Street ends higher despite Nvidia data centre miss , Fed turmoil",https://www.sharecast.com/news/market-report-us-close/us-close-wall-street-ends-higher-despite-nvidia-data-centre-miss-fed-turmoil--20791906.html,sharecast.com,English,0.0,gdelt_gkg
AAPL,2025-08-28,"Apple , Google , Nvidia Unleash $430 Billion Buyback Blitz - Alphabet ( NASDAQ : GOOGL ), NVIDIA ( NASDAQ : NVDA ) ",https://www.benzinga.com/markets/tech/25/08/47398153/apple-google-nvidia-unleash-430-billion-buyback-blitz-but-is-innovation-falling-behind,benzinga.com,English,0.0,gdelt_gkg
AAPL,2025-08-28,Evercore ISI Reiterates Outperform on Apple ( AAPL ) With $250 PT,https://www.insidermonkey.com/blog/evercore-isi-reiterates-outperform-on-apple-aapl-with-250-pt-1598461/,insidermonkey.com,English,0.0,gdelt_gkg
AAPL,2025-08-28,طال انتظاره .. غوغل تطلق  الوضع الداكن الموسع  لتطبيقات آندرويد,https://www.eremnews.com/sciences-technology/bi4cgwt,eremnews.com,Arabic,0.0,gdelt_gkg
AAPL,2025-08-28,حرب شهر سبتمبر تشتعل .. ماذا في جعبة أبل وسامسونغ ؟ ,https://shasha.ps/home/%D8%AD%D8%B1%D8%A8-%D8%B4%D9%87%D8%B1-%D8%B3%D8%A8%D8%AA%D9%85%D8%A8%D8%B1-%D8%AA%D8%B4%D8%AA%D8%B9%D9%84-%D9%85%D8%A7%D8%B0%D8%A7-%D9%81%D9%8A-%D8%AC%D8%B9%D8%A8%D8%A9,shasha.ps,Arabic,0.0,gdelt_gkg
AAPL,2025-08-28,Can Apple ( AAPL ) AI Partnerships Revive Investor Sentiment ? ,https://finance.yahoo.com/news/apple-aapl-ai-partnerships-revive-035349828.html,finance.yahoo.com,English,0.0,gdelt_gkg
AAPL,2025-08-28,"Loop Capital Lowers Price Target on Apple ( AAPL ) to $226 , Maintains Hold",https://finance.yahoo.com/news/loop-capital-lowers-price-target-012045593.html,finance.yahoo.com,English,0.0,gdelt_gkg
AAPL,2025-08-28,"Apple Takes On Spotify , Expands Music Service To TuneIn 75 Million Users : Report - Spotify Technology ( NYSE : SPOT ) ",https://www.benzinga.com/news/entertainment/25/08/47377888/apple-takes-on-spotify-expands-music-service-to-tuneins-75-million-users-report,benzinga.com,English,0.0,gdelt_gkg
AAPL,2025-08-28,4 نسخ وتقنيات ثورية .. أبل تحدد رسمياً موعد إطلاق  آيفون 17  ,https://www.albayan.ae/technology/science-technology/415664,albayan.ae,Arabic,0.0,gdelt_gkg
AAPL,2025-08-28,"U . S . slaps India with 50 % tariffs , among highest globally",https://financialpost.com/news/india-tariff-shock-trump-levies,financialpost.com,English,0.0,gdelt_gkg
AAPL,2025-08-28,Apple Inc . ( $AAPL ) blue box area offers a buying opportunity,https://www.fxstreet.com/news/apple-inc-aapl-blue-box-area-offers-a-buying-opportunity-202508271359,fxstreet.com,English,0.0,gdelt_gkg
AAPL,2025-08-28,"Less Stress , More Success 9 Ways to Maximize Free Checking - The Arizona State Press",https://www.statepress.com/article/2025/08/sponsored-less-stress-more-success,statepress.com,English,0.0,gdelt_gkg
AAPL,2025-08-28,Why Warren Buffett is still relevant even as he turns 95,https://www.theglobeandmail.com/investing/article-why-warren-buffett-is-still-relevant-even-as-he-turns-95/,theglobeandmail.com,English,0.0,gdelt_gkg
AAPL,2025-08-28,"Apple Stock Could Hit An  All - Time High  The Day It Does This , Says Analyst",https://biztoc.com/x/0e69da6149073674,biztoc.com,English,0.0,gdelt_gkg
AAPL,2025-08-29,"Apple Inc . ( AAPL ): The AI  Will Come Into Play Soon , Says Jim Cramer",https://www.insidermonkey.com/blog/apple-inc-aapl-the-ai-will-come-into-play-soon-says-jim-cramer-1600021/,insidermonkey.com,English,0.0,gdelt_gkg
AAPL,2025-08-29,"Samsung , SK Hynix Lose US Waiver on Chip Gear for China Use",https://www.livemint.com/companies/news/samsung-sk-hynix-lose-us-waiver-on-chip-gear-for-china-use-11756500460846.html,livemint.com,English,0.0,gdelt_gkg
AAPL,2025-08-29,"Apple Pay makes considerable progress with more than 700 , 000 retail sites and growing",https://macdailynews.com/2015/06/05/apple-pay-makes-considerable-progress-with-more-than-700000-retail-sites-and-growing/,macdailynews.com,English,0.0,gdelt_gkg
AAPL,2025-08-29,Apple August stock revival gives hope to concerned investors,https://financialpost.com/investing/apple-august-stock-revival-hope-concerned-investors,financialpost.com,English,0.0,gdelt_gkg
AAPL,2025-08-29,Nvidia hyper - growth keeps stock valuation out of bubble zone – East Bay Times,https://www.eastbaytimes.com/2025/08/29/nvidias-hyper-growth-keeps-stock-valuation-out-of-bubble-zone/,eastbaytimes.com,English,0.0,gdelt_gkg
AAPL,2025-08-29,A Look Into Apple Inc Price Over Earnings,https://biztoc.com/x/9f7ecacb769d64e9,biztoc.com,English,0.0,gdelt_gkg
AAPL,2025-08-29,Building an Automatic Reconciliation Engine : How We Match Receipts to Transactions,https://midday.ai/updates/automatic-reconciliation-engine/,midday.ai,English,0.0,gdelt_gkg
AAPL,2025-08-29,Apple and Windows users urged to turn on free feature or risk cyber attack,https://www.dailystar.co.uk/tech/apple-windows-users-urged-turn-35815613,dailystar.co.uk,English,0.0,gdelt_gkg
AAPL,2025-08-29,Shock at Microsoft Silicon Valley Campus after 35 - year - old techie Pratik Pandey found dead in office,https://www.livemint.com/news/shock-at-microsoft-silicon-valley-campus-after-35-year-old-techie-pratik-pandey-found-dead-in-office-11756465575429.html,livemint.com,English,0.0,gdelt_gkg
AAPL,2025-08-29,Think the S & P 500 is too expensive ? Check out these ETFs instead . ,https://finance.yahoo.com/news/think-p-500-too-expensive-014900744.html,finance.yahoo.com,English,0.0,gdelt_gkg
AAPL,2025-08-29,"Indian textiles , jewellery slapped with 50 % Trump tariff ; pharma , phones exempt",https://www.khaleejtimes.com/business/indian-textiles-jewellery-slapped-with-50-trump-tariff-pharma-phones-exempt,khaleejtimes.com,English,0.0,gdelt_gkg
AAPL,2025-08-29,Apple ( AAPL ) Growth Momentum Intact Despite Antitrust Headwinds,https://www.insidermonkey.com/blog/apples-aapl-growth-momentum-intact-despite-antitrust-headwinds-1599179/,insidermonkey.com,English,0.0,gdelt_gkg
AAPL,2025-08-29,Apple ( AAPL ) Explores Google Gemini AI for Siri Revamp,https://www.insidermonkey.com/blog/apple-aapl-explores-google-gemini-ai-for-siri-revamp-1599080/,insidermonkey.com,English,0.0,gdelt_gkg
AAPL,2025-08-29,Microsoft software engineer dies on Silicon Valley campus at 35,https://www.thestar.com.my/tech/tech-news/2025/08/29/microsoft-software-engineer-dies-on-silicon-valley-campus-at-35,thestar.com.my,English,0.0,gdelt_gkg
AAPL,2025-08-29,4chan Sues united kingdom Regulator Over Online Safety Law After Trump Administration Pressure Forces united kingdom To Drop Apple Encryption Backdoor,https://biztoc.com/x/78d2909f93e1cbd9,biztoc.com,English,0.0,gdelt_gkg
AAPL,2025-08-29,"Google Gmail Faces Scrutiny As FTC Alleges Republican Emails Are Sent To Spam More Often Than Democrat Messages - Alphabet ( NASDAQ : GOOG ), Apple ( NASDAQ : AAPL ) ",https://www.benzinga.com/markets/tech/25/08/47404088/googles-gmail-faces-scrutiny-as-ftc-alleges-republican-emails-are-sent-to-spam-more-often-than-democ,benzinga.com,English,0.0,gdelt_gkg
AAPL,2025-08-29,  He often worked late … Family speaks out after 35 - year - old Indian Microsoft engineer Pratik Pandey dies on Silicon Valley campus - Technology News,https://www.financialexpress.com/life/technology-he-often-worked-late-family-speaks-out-after-35-year-old-indian-microsoft-engineer-pratik-pandey-dies-on-silicon-valley-campus-3960799/,financialexpress.com,English,0.0,gdelt_gkg
AAPL,2025-08-29,"Google Gmail Faces Scrutiny As FTC Alleges Republican Emails Are Sent To Spam More Often Than Democrat Messages - Alphabet ( NASDAQ : GOOG ), Apple ( NASDAQ : AAPL ) ",https://www.benzinga.com/markets/tech/25/08/47404088/googles-gmail-faces-scrutiny-as-ftc-alleges-republican-emails-are-sent-to-spam-more-often-than-democrats-messages,benzinga.com,English,0.0,gdelt_gkg
AAPL,2025-08-29,死對頭變盟友 川普成了祖克伯打手 - 國際,https://www.chinatimes.com/realtimenews/20250829002907-260408,chinatimes.com,Chinese,0.0,gdelt_gkg
AAPL,2025-08-29,Apple Warns united kingdom Regulators : DMA Rules Could Stifle Innovation and Investment,https://www.webpronews.com/apple-warns-uk-regulators-dma-rules-could-stifle-innovation-and-investment/,webpronews.com,English,0.0,gdelt_gkg
AAPL,2025-08-30,Nvidia has $57 billion in cash . Wall Street has ideas about what to do with it . ,https://www.morningstar.com/news/marketwatch/20250830184/nvidia-has-57-billion-in-cash-wall-street-has-ideas-about-what-to-do-with-it,morningstar.com,English,0.0,gdelt_gkg
AAPL,2025-08-30,學蘋果或另有精明盤算 ？ 輝達再買600億美元庫藏股引熱議 | 全球財經 | 全球,https://udn.com/news/story/6811/8973662,udn.com,Chinese,0.0,gdelt_gkg
